StockCode,Description,UnitPrice,QuantityAvailable,Product_Created,Product_lastUpdated,Ratings
85123A,WHITE HANGING HEART T-LIGHT HOLDER,2.55,85,2011-01-09,2011-09-09,1.0
71053,WHITE METAL LANTERN,3.39,66,2011-01-11,2011-09-09,3.25
84406B,CREAM CUPID HEARTS COAT HANGER,2.75,98,2011-01-09,2011-09-07,4.5
84029G,KNITTED UNION FLAG HOT WATER BOTTLE,3.39,85,2011-01-10,2011-09-08,2.75
84029E,RED WOOLLY HOTTIE WHITE HEART.,3.39,239,2011-01-10,2011-09-09,4.5
22752,SET 7 BABUSHKA NESTING BOXES,7.65,199,2011-01-12,2011-09-09,4.0
21730,GLASS STAR FROSTED T-LIGHT HOLDER,4.25,99,2011-01-12,2011-09-30,2.25
22633,HAND WARMER UNION JACK,1.85,134,2011-10-09,2011-09-09,1.5
22632,HAND WARMER RED POLKA DOT,1.85,250,2011-01-04,2011-09-08,5.0
84879,ASSORTED COLOUR BIRD ORNAMENT,1.69,147,2011-01-09,2011-09-09,4.0
22745,POPPY'S PLAYHOUSE BEDROOM ,2.1,246,2011-01-10,2011-09-09,4.25
22748,POPPY'S PLAYHOUSE KITCHEN,2.1,184,2011-01-10,2011-09-09,3.75
22749,FELTCRAFT PRINCESS CHARLOTTE DOLL,3.75,121,2011-01-09,2011-09-09,1.5
22310,IVORY KNITTED MUG COSY ,1.65,99,2011-01-09,2011-09-09,2.25
84969,BOX OF 6 ASSORTED COLOUR TEASPOONS,4.25,165,2011-01-09,2011-09-08,3.5
22623,BOX OF VINTAGE JIGSAW BLOCKS ,4.95,95,2011-01-10,2011-09-07,3.5
22622,BOX OF VINTAGE ALPHABET BLOCKS,9.95,81,2011-01-09,2011-09-09,3.25
21754,HOME BUILDING BLOCK WORD,5.95,141,2011-01-09,2011-09-09,4.75
21755,LOVE BUILDING BLOCK WORD,5.95,74,2011-01-09,2011-09-09,2.0
21777,RECIPE BOX WITH METAL HEART,7.95,200,2010-11-30,2010-12-09,5.0
48187,DOORMAT NEW ENGLAND,7.95,85,2011-01-09,2011-09-09,3.25
22960,JAM MAKING SET WITH JARS,4.25,246,2011-01-09,2011-09-09,2.75
22913,RED COAT RACK PARIS FASHION,4.95,146,2011-01-09,2011-09-07,4.0
22912,YELLOW COAT RACK PARIS FASHION,4.95,55,2011-01-09,2011-09-08,1.25
22914,BLUE COAT RACK PARIS FASHION,4.95,169,2011-01-09,2011-09-08,2.0
21756,BATH BUILDING BLOCK WORD,5.95,133,2011-01-09,2011-09-08,2.75
22728,ALARM CLOCK BAKELIKE PINK,3.75,174,2011-01-09,2011-09-09,4.75
22727,ALARM CLOCK BAKELIKE RED ,3.75,53,2011-01-09,2011-09-09,3.0
22726,ALARM CLOCK BAKELIKE GREEN,3.75,187,2011-01-09,2011-09-09,4.0
21724,PANDA AND BUNNIES STICKER SHEET,0.85,219,2011-01-11,2011-09-28,4.75
21883,STARS GIFT TAPE ,0.65,155,2011-01-09,2011-09-08,5.0
10002,INFLATABLE POLITICAL GLOBE ,0.85,187,2011-01-10,2011-04-03,1.5
21791,VINTAGE HEADS AND TAILS CARD GAME ,1.25,243,2011-01-09,2011-09-09,1.75
21035,SET/2 RED RETROSPOT TEA TOWELS ,2.95,193,2011-01-09,2011-09-09,1.0
22326,ROUND SNACK BOXES SET OF4 WOODLAND ,2.95,169,2011-01-10,2011-09-09,2.5
22629,SPACEBOY LUNCH BOX ,1.95,244,2011-01-09,2011-09-09,3.75
22659,LUNCH BOX I LOVE LONDON,1.95,183,2011-01-09,2011-09-09,2.0
22631,CIRCUS PARADE LUNCH BOX ,1.95,89,2011-01-09,2011-09-09,3.75
22661,CHARLOTTE BAG DOLLY GIRL DESIGN,0.85,200,2011-01-09,2011-09-09,4.0
21731,RED TOADSTOOL LED NIGHT LIGHT,1.65,238,2011-01-09,2011-09-09,4.75
22900, SET 2 TEA TOWELS I LOVE LONDON ,2.95,55,2011-01-09,2011-09-07,1.25
21913,VINTAGE SEASIDE JIGSAW PUZZLES,3.75,147,2011-01-09,2011-09-30,3.75
22540,MINI JIGSAW CIRCUS PARADE ,0.42,200,2011-01-09,2011-09-30,3.25
22544,MINI JIGSAW SPACEBOY,0.42,218,2011-01-11,2011-09-04,3.75
22492,MINI PAINT SET VINTAGE ,0.65,144,2011-01-09,2011-09-09,4.5
POST,POSTAGE,18.0,244,2011-01-09,2011-09-09,4.75
22086,PAPER CHAIN KIT 50'S CHRISTMAS ,2.55,92,2011-01-09,2011-09-09,1.25
20679,EDWARDIAN PARASOL RED,4.95,173,2011-01-09,2011-09-09,1.5
37370,RETRO COFFEE MUGS ASSORTED,1.06,227,2011-01-10,2011-09-04,2.0
21871,SAVE THE PLANET MUG,1.06,135,2011-01-09,2011-09-09,2.25
21071,VINTAGE BILLBOARD DRINK ME MUG,1.06,143,2011-01-10,2011-09-09,1.0
21068,VINTAGE BILLBOARD LOVE/HATE MUG,1.06,61,2011-01-09,2011-09-09,1.25
82483,WOOD 2 DRAWER CABINET WHITE FINISH,4.95,209,2011-01-09,2011-09-09,3.25
82486,WOOD S/3 CABINET ANT WHITE FINISH,6.95,229,2011-01-09,2011-09-08,1.75
82482,WOODEN PICTURE FRAME WHITE FINISH,2.1,145,2011-01-09,2011-09-09,4.25
82494L,WOODEN FRAME ANTIQUE WHITE ,2.55,50,2011-01-09,2011-09-09,4.0
21258,VICTORIAN SEWING BOX LARGE,10.95,161,2011-01-09,2011-09-09,1.5
22114,HOT WATER BOTTLE TEA AND SYMPATHY,3.45,245,2011-01-24,2011-09-09,5.0
21733,RED HANGING HEART T-LIGHT HOLDER,2.55,200,2011-01-09,2011-09-09,3.25
22386,JUMBO BAG PINK POLKADOT,1.95,76,2011-01-09,2011-09-09,4.5
85099C,JUMBO  BAG BAROQUE BLACK WHITE,1.95,239,2011-01-09,2011-09-09,1.25
21033,JUMBO BAG CHARLIE AND LOLA TOYS,2.95,69,2011-01-09,2011-09-08,4.25
20723,STRAWBERRY CHARLOTTE BAG,0.85,213,2011-01-09,2011-09-09,1.5
84997B,RED 3 PIECE RETROSPOT CUTLERY SET,3.75,77,2011-01-09,2011-09-08,4.75
84997C,BLUE 3 PIECE POLKADOT CUTLERY SET,3.75,175,2011-01-09,2011-09-08,3.5
21094,SET/6 RED SPOTTY PAPER PLATES,0.85,144,2011-01-10,2011-09-09,3.75
20725,LUNCH BAG RED RETROSPOT,1.65,108,2011-01-09,2011-09-09,1.0
21559,STRAWBERRY LUNCH BOX WITH CUTLERY,2.55,229,2011-01-09,2011-09-08,3.0
22352,LUNCH BOX WITH CUTLERY RETROSPOT ,2.55,51,2011-01-09,2011-09-09,4.75
21212,PACK OF 72 RETROSPOT CAKE CASES,0.42,56,2011-01-09,2011-09-09,4.5
21975,PACK OF 60 DINOSAUR CAKE CASES,0.55,135,2011-01-09,2011-09-09,3.25
21977,PACK OF 60 PINK PAISLEY CAKE CASES,0.55,206,2011-01-09,2011-09-09,3.5
84991,60 TEATIME FAIRY CAKE CASES,0.55,131,2011-01-09,2011-09-09,1.0
84519A,TOMATO CHARLIE+LOLA COASTER SET,2.95,173,2011-01-09,2011-09-26,4.5
85183B,CHARLIE & LOLA WASTEPAPER BIN FLORA,1.25,245,2011-01-09,2011-09-04,4.5
85071B,RED CHARLIE+LOLA PERSONAL DOORSIGN,0.38,199,2011-01-09,2011-09-09,1.25
21931,JUMBO STORAGE BAG SUKI,1.95,166,2011-01-09,2011-09-09,4.25
21929,JUMBO BAG PINK VINTAGE PAISLEY,1.95,230,2011-01-09,2011-09-09,2.75
22961,JAM MAKING SET PRINTED,1.45,68,2011-01-09,2011-09-09,1.25
22139,RETROSPOT TEA SET CERAMIC 11 PC ,4.25,76,2011-01-09,2011-09-09,4.5
84854,GIRLY PINK TOOL SET,4.95,108,2010-11-30,2010-12-01,4.5
22411,JUMBO SHOPPER VINTAGE RED PAISLEY,1.95,67,2011-01-09,2011-09-09,4.25
82567,"AIRLINE LOUNGE,METAL SIGN",2.1,198,2011-01-09,2011-09-06,4.75
21672,WHITE SPOT RED CERAMIC DRAWER KNOB,1.25,213,2011-01-09,2011-09-09,4.5
22774,RED DRAWER KNOB ACRYLIC EDWARDIAN,1.25,201,2011-01-10,2011-09-07,4.0
22771,CLEAR DRAWER KNOB ACRYLIC EDWARDIAN,1.25,55,2011-01-09,2011-09-09,1.75
71270,PHOTO CLIP LINE,1.25,241,2011-01-10,2011-09-06,1.75
22262,FELT EGG COSY CHICKEN,0.85,173,2011-01-12,2011-09-05,2.25
22637,PIGGY BANK RETROSPOT ,2.55,160,2011-01-10,2011-09-09,1.5
21934,SKULL SHOULDER BAG,1.65,126,2011-01-09,2011-09-09,4.5
21169,YOU'RE CONFUSING ME METAL SIGN ,1.69,106,2011-01-09,2011-09-09,1.75
21166,COOK WITH WINE METAL SIGN ,1.95,249,2011-01-09,2011-09-09,5.0
21175,GIN + TONIC DIET METAL SIGN,2.1,94,2011-01-09,2011-09-09,2.25
37444A,YELLOW BREAKFAST CUP AND SAUCER,2.95,50,2011-01-16,2011-07-13,4.75
37444C,PINK BREAKFAST CUP AND SAUCER ,2.95,232,2011-01-09,2011-03-08,4.5
22083,PAPER CHAIN KIT RETROSPOT,2.95,79,2011-01-09,2011-09-09,2.0
84971S,SMALL HEART FLOWERS HOOK ,0.85,113,2011-01-09,2011-09-08,1.25
47580,TEA TIME DES TEA COSY,2.55,164,2011-01-09,2011-09-04,5.0
22261,FELT EGG COSY WHITE RABBIT ,0.85,199,2011-01-12,2011-09-05,1.75
84832,ZINC WILLIE WINKIE  CANDLE STICK,0.85,175,2011-01-09,2011-09-09,3.75
22644,CERAMIC CHERRY CAKE MONEY BANK,1.45,136,2011-01-10,2011-09-09,2.75
21533,RETROSPOT LARGE MILK JUG,4.95,116,2011-01-09,2011-09-09,5.0
21557,SET OF 6 FUNKY BEAKERS,2.95,99,2011-01-09,2011-09-28,4.25
15056BL,EDWARDIAN PARASOL BLACK,5.95,194,2011-01-12,2011-09-09,1.75
15056N,EDWARDIAN PARASOL NATURAL,5.95,243,2011-01-09,2011-09-09,4.25
22646,CERAMIC STRAWBERRY CAKE MONEY BANK,1.45,68,2011-01-10,2011-09-09,2.0
22176,BLUE OWL SOFT TOY,2.95,239,2011-01-10,2011-09-08,4.5
22438,BALLOON ART MAKE YOUR OWN FLOWERS,1.95,226,2011-01-09,2011-09-28,1.75
22778,GLASS CLOCHE SMALL,3.95,79,2011-01-09,2011-09-08,4.0
22719,GUMBALL MONOCHROME COAT RACK,1.06,173,2011-01-09,2011-05-04,1.25
21523,DOORMAT FANCY FONT HOME SWEET HOME,6.75,76,2011-01-09,2011-09-09,4.25
D,Discount,27.5,108,2011-01-04,2011-09-09,1.25
21912,VINTAGE SNAKES & LADDERS,3.75,98,2011-01-10,2011-09-09,1.5
21832,CHOCOLATE CALCULATOR,1.65,127,2011-01-11,2011-09-08,3.5
22379,RECYCLING BAG RETROSPOT ,2.1,81,2011-01-09,2011-09-09,4.0
22381,TOY TIDY PINK POLKADOT,1.85,171,2011-01-09,2011-09-09,1.75
22798,ANTIQUE GLASS DRESSING TABLE POT,2.95,187,2011-01-09,2011-09-09,2.0
22926,IVORY GIANT GARDEN THERMOMETER,5.95,138,2011-01-09,2011-05-09,3.25
22839,3 TIER CAKE TIN GREEN AND CREAM,14.95,229,2011-01-09,2011-09-08,2.25
22838,3 TIER CAKE TIN RED AND CREAM,14.95,159,2011-01-09,2011-09-08,5.0
22783,SET 3 WICKER OVAL BASKETS W LIDS,16.95,190,2011-01-09,2011-06-07,4.25
35004C,SET OF 3 COLOURED  FLYING DUCKS,4.65,128,2011-01-10,2011-03-07,3.75
82484,WOOD BLACK BOARD ANT WHITE FINISH,6.45,167,2011-01-09,2011-09-09,3.0
84755,COLOUR GLASS T-LIGHT HOLDER HANGING,0.65,192,2011-01-09,2011-09-09,5.0
22464,HANGING METAL HEART LANTERN,1.65,71,2011-01-10,2011-09-08,4.5
21324,HANGING MEDINA LANTERN SMALL,2.95,93,2011-01-10,2011-05-09,1.25
22457,NATURAL SLATE HEART CHALKBOARD ,2.95,94,2011-01-09,2011-09-09,4.5
22469,HEART OF WICKER SMALL,1.45,233,2011-01-09,2011-09-09,4.25
22470,HEART OF WICKER LARGE,2.55,250,2011-01-09,2011-09-09,4.25
22224,WHITE LOVEBIRD LANTERN,2.95,139,2011-01-09,2011-09-28,1.25
21340,CLASSIC METAL BIRDCAGE PLANT HOLDER,12.75,192,2011-01-10,2011-09-09,2.75
22189,CREAM HEART CARD HOLDER,3.95,226,2011-01-09,2011-09-08,2.25
22427,ENAMEL FLOWER JUG CREAM,5.95,245,2011-01-09,2011-09-08,1.75
22428,ENAMEL FIRE BUCKET CREAM,6.95,169,2011-01-12,2011-09-09,2.75
22424,ENAMEL BREAD BIN CREAM,10.95,176,2011-01-09,2011-09-09,4.25
22663,JUMBO BAG DOLLY GIRL DESIGN,1.95,129,2011-01-10,2011-09-09,1.0
85049A,TRADITIONAL CHRISTMAS RIBBONS,1.25,101,2011-01-09,2011-09-07,3.0
22168,ORGANISER WOOD ANTIQUE WHITE ,8.5,93,2011-01-10,2011-04-05,2.0
22662,LUNCH BAG DOLLY GIRL DESIGN,1.65,67,2011-01-10,2011-09-09,1.75
84880,WHITE WIRE EGG HOLDER,4.95,56,2011-01-19,2011-09-25,3.5
85099B,JUMBO BAG RED RETROSPOT,1.65,57,2011-01-09,2011-09-09,1.25
79321,CHILLI LIGHTS,3.82,55,2011-01-09,2011-09-09,3.5
22780,LIGHT GARLAND BUTTERFILES PINK,3.37,123,2011-01-10,2011-09-09,3.0
22779,WOODEN OWLS LIGHT GARLAND ,3.37,146,2011-01-15,2011-09-09,3.25
22466,FAIRY TALE COTTAGE NIGHTLIGHT,1.45,153,2011-01-09,2011-09-09,4.0
21363,HOME SMALL WOOD LETTERS,4.95,177,2011-01-09,2011-09-09,3.25
21411,GINGHAM HEART  DOORSTOP RED,4.25,243,2011-01-09,2011-09-07,1.0
22318,FIVE HEART HANGING DECORATION,2.95,225,2011-01-13,2011-09-29,4.0
22915,ASSORTED BOTTLE TOP  MAGNETS ,0.42,126,2011-01-09,2011-09-06,1.25
22922,FRIDGE MAGNETS US DINER ASSORTED,0.85,246,2011-01-10,2011-09-09,3.75
22969,HOMEMADE JAM SCENTED CANDLES,1.45,145,2011-01-09,2011-09-09,4.0
22923,FRIDGE MAGNETS LES ENFANTS ASSORTED,0.85,130,2011-01-15,2011-09-09,3.5
21115,ROSE CARAVAN DOORSTOP,6.75,91,2011-01-09,2011-09-29,4.0
22242,5 HOOK HANGER MAGIC TOADSTOOL,1.65,224,2011-01-12,2011-02-08,2.5
22941,CHRISTMAS LIGHTS 10 REINDEER,8.5,156,2011-01-11,2011-09-09,3.75
21622,VINTAGE UNION JACK CUSHION COVER,4.95,181,2011-01-09,2011-09-22,3.0
35004G,SET OF 3 GOLD FLYING DUCKS,6.35,228,2011-10-15,2011-09-08,5.0
85014B,RED RETROSPOT UMBRELLA,5.95,86,2011-01-09,2011-09-09,3.75
85014A,BLACK/BLUE POLKADOT UMBRELLA,5.95,162,2011-01-09,2011-09-09,3.5
22193,RED DINER WALL CLOCK,8.5,169,2011-01-10,2011-09-09,3.75
22192,BLUE DINER WALL CLOCK,8.5,157,2011-01-11,2011-09-09,1.75
22191,IVORY DINER WALL CLOCK,8.5,69,2011-01-10,2011-09-09,2.25
22195,LARGE HEART MEASURING SPOONS,1.65,156,2011-01-09,2011-09-09,2.5
22196,SMALL HEART MEASURING SPOONS,0.85,148,2011-01-09,2011-09-08,2.0
22962,JAM JAR WITH PINK LID,0.72,228,2011-01-09,2011-09-09,1.75
22963,JAM JAR WITH GREEN LID,0.72,132,2011-01-09,2011-09-09,1.25
22968,ROSE COTTAGE KEEPSAKE BOX ,8.5,110,2011-01-09,2011-09-06,4.75
84970S,HANGING HEART ZINC T-LIGHT HOLDER,0.64,183,2011-01-09,2011-09-08,3.75
22910,PAPER CHAIN KIT VINTAGE CHRISTMAS,2.55,247,2011-01-09,2011-09-09,1.25
20668,DISCO BALL CHRISTMAS DECORATION,0.1,234,2011-01-11,2011-09-07,3.5
22197,SMALL POPCORN HOLDER,0.72,89,2011-01-09,2011-09-09,3.75
22198,LARGE POPCORN HOLDER ,1.45,233,2011-01-09,2011-05-01,4.5
21080,SET/20 RED RETROSPOT PAPER NAPKINS ,0.64,169,2011-01-09,2011-09-09,3.0
21086,SET/6 RED SPOTTY PAPER CUPS,0.65,167,2011-01-10,2011-09-09,4.25
21786,POLKADOT RAIN HAT ,0.32,155,2011-01-12,2011-09-08,3.25
22654,DELUXE SEWING KIT ,4.95,136,2011-01-09,2011-09-07,1.0
21485,RETROSPOT HEART HOT WATER BOTTLE,4.25,226,2011-01-09,2011-09-09,3.5
84030E,ENGLISH ROSE HOT WATER BOTTLE,3.75,207,2011-01-09,2011-09-08,4.25
22174,PHOTO CUBE,1.48,176,2011-01-09,2011-09-09,4.75
22556,PLASTERS IN TIN CIRCUS PARADE ,1.65,83,2011-01-09,2011-09-09,4.75
21984,PACK OF 12 PINK PAISLEY TISSUES ,0.29,133,2011-01-09,2011-09-09,1.0
21983,PACK OF 12 BLUE PAISLEY TISSUES ,0.29,102,2011-01-11,2011-09-09,5.0
21980,PACK OF 12 RED RETROSPOT TISSUES ,0.29,198,2011-01-09,2011-09-09,2.0
21484,CHICK GREY HOT WATER BOTTLE,3.45,145,2011-01-09,2011-09-09,1.0
22557,PLASTERS IN TIN VINTAGE PAISLEY ,1.65,174,2011-01-09,2011-09-09,3.25
22553,PLASTERS IN TIN SKULLS,1.65,151,2011-01-09,2011-09-09,2.0
22150,3 STRIPEY MICE FELTCRAFT,1.95,182,2011-01-10,2011-09-09,4.5
22619,SET OF 6 SOLDIER SKITTLES,3.75,56,2011-01-10,2011-09-08,3.5
21891,TRADITIONAL WOODEN SKIPPING ROPE,1.25,76,2011-01-10,2011-09-08,3.75
21889,WOODEN BOX OF DOMINOES,1.25,65,2011-01-09,2011-09-09,1.5
22827,RUSTIC  SEVENTEEN DRAWER SIDEBOARD,165.0,174,2011-01-11,2011-09-09,4.0
22127,PARTY CONES CARNIVAL ASSORTED,1.25,201,2011-01-25,2011-03-09,3.75
22128,PARTY CONES CANDY ASSORTED,1.25,111,2011-01-12,2011-09-05,4.5
22502,PICNIC BASKET WICKER SMALL,5.95,85,2011-01-11,2011-09-04,2.75
22338,STAR DECORATION PAINTED ZINC ,0.65,79,2011-01-09,2011-09-08,3.75
22180,RETROSPOT LAMP,9.95,131,2011-01-09,2011-09-09,1.5
21506,"FANCY FONT BIRTHDAY CARD, ",0.42,63,2011-01-09,2011-09-08,1.75
22866,HAND WARMER SCOTTY DOG DESIGN,1.85,56,2011-01-22,2011-09-09,3.75
22865,HAND WARMER OWL DESIGN,1.85,182,2011-01-10,2011-09-09,4.75
22349,DOG BOWL CHASING BALL DESIGN,3.75,124,2011-01-10,2011-09-09,1.5
22558,CLOTHES PEGS RETROSPOT PACK 24 ,1.25,208,2011-01-09,2011-09-09,3.25
85152,HAND OVER THE CHOCOLATE   SIGN ,2.1,52,2011-01-09,2011-09-09,1.75
22652,TRAVEL SEWING KIT,1.65,70,2011-01-10,2011-09-09,3.25
22188,BLACK HEART CARD HOLDER,3.95,112,2011-01-10,2011-09-05,2.25
21314,SMALL GLASS HEART TRINKET POT,2.1,65,2011-01-09,2011-09-09,4.75
22730,ALARM CLOCK BAKELIKE IVORY,3.75,202,2011-01-09,2011-09-09,2.0
22729,ALARM CLOCK BAKELIKE ORANGE,3.75,187,2011-01-09,2011-09-09,1.0
22867,HAND WARMER BIRD DESIGN,2.1,188,2011-01-16,2011-09-08,5.0
22803,IVORY EMBROIDERED QUILT ,35.75,211,2011-01-18,2011-08-12,4.75
35004B,SET OF 3 BLACK FLYING DUCKS,4.65,247,2011-01-10,2011-09-09,2.25
21844,RED RETROSPOT MUG,2.95,233,2011-01-09,2011-09-09,2.0
22468,BABUSHKA LIGHTS STRING OF 10,6.75,160,2011-01-09,2011-09-08,4.75
48185,DOORMAT FAIRY CAKE,7.95,86,2011-01-09,2011-09-09,2.5
21232,STRAWBERRY CERAMIC TRINKET BOX,1.25,156,2011-01-09,2011-09-09,4.0
22064,PINK DOUGHNUT TRINKET POT ,1.65,117,2011-01-09,2011-09-09,2.25
22449,SILK PURSE BABUSHKA PINK,3.35,54,2011-01-12,2011-09-09,4.0
22835,HOT WATER BOTTLE I AM SO POORLY,4.65,159,2011-01-09,2011-09-09,3.25
22112,CHOCOLATE HOT WATER BOTTLE,4.95,233,2011-01-10,2011-09-09,4.5
21479,WHITE SKULL HOT WATER BOTTLE ,3.75,140,2011-01-10,2011-09-09,3.25
22111,SCOTTIE DOG HOT WATER BOTTLE,4.95,163,2011-01-09,2011-09-09,3.0
22110,BIRD HOUSE HOT WATER BOTTLE,2.55,215,2011-01-09,2011-09-08,1.5
22098,BOUDOIR SQUARE TISSUE BOX,1.25,239,2011-01-12,2011-09-09,1.5
22100,SKULLS SQUARE TISSUE BOX,1.25,234,2011-01-12,2011-09-28,1.0
22766,PHOTO FRAME CORNICE,2.95,146,2011-01-09,2011-09-08,2.5
22451,SILK PURSE BABUSHKA RED,3.35,71,2011-01-09,2011-05-13,3.5
22549,PICTURE DOMINOES,1.45,237,2011-01-10,2011-09-09,3.75
84744,S/6 SEW ON CROCHET FLOWERS,1.25,221,2011-01-09,2011-09-13,1.25
85049E,SCANDINAVIAN REDS RIBBONS,1.25,84,2011-01-09,2011-09-09,4.0
21328,BALLOONS  WRITING SET ,1.65,145,2011-01-09,2011-09-09,1.75
17091A,LAVENDER INCENSE IN TIN,1.25,173,2011-01-05,2011-05-08,2.5
22473,TV DINNER TRAY VINTAGE PAISLEY,4.95,200,2011-01-09,2011-09-26,1.75
84509A,SET OF 4 ENGLISH ROSE PLACEMATS,3.75,110,2011-01-09,2011-09-08,4.25
84510A,SET OF 4 ENGLISH ROSE COASTERS,1.25,249,2011-01-09,2011-09-08,2.5
22767,TRIPLE PHOTO FRAME CORNICE ,9.95,96,2011-01-09,2011-09-08,4.25
22768,FAMILY PHOTO FRAME CORNICE,9.95,213,2011-01-10,2011-09-08,2.25
21463,MIRRORED DISCO BALL ,5.95,248,2011-01-11,2011-09-07,4.5
21464,DISCO BALL ROTATOR BATTERY OPERATED,4.25,104,2011-01-10,2011-09-07,2.75
20820,SILVER LOOKING MIRROR,4.95,230,2010-11-30,2011-03-01,3.75
85150,LADIES & GENTLEMEN METAL SIGN,2.55,160,2011-01-09,2011-09-09,2.5
22117,METAL SIGN HER DINNER IS SERVED ,2.95,174,2011-01-09,2011-09-09,3.5
48129,DOORMAT TOPIARY,7.95,233,2011-01-09,2011-09-07,3.5
82580,BATHROOM METAL SIGN,0.55,229,2011-01-09,2011-09-09,1.25
82578,KITCHEN METAL SIGN,0.55,210,2011-01-09,2011-09-09,1.0
82581,TOILET METAL SIGN,0.55,206,2011-01-09,2011-09-09,3.75
22413,METAL SIGN TAKE IT OR LEAVE IT ,2.95,119,2011-01-09,2011-09-09,3.5
21907,I'M ON HOLIDAY METAL SIGN,2.1,188,2011-01-09,2011-09-09,1.0
22441,GROW YOUR OWN BASIL IN ENAMEL MUG,2.1,63,2011-01-09,2011-09-07,1.5
21122,SET/10 PINK POLKADOT PARTY CANDLES,1.25,143,2011-01-09,2011-09-08,1.0
22851,SET 20 NAPKINS FAIRY CAKES DESIGN ,0.85,137,2011-01-09,2011-09-09,4.0
22810,SET OF 6 T-LIGHTS SNOWMEN,2.95,68,2011-01-27,2011-09-08,3.25
22809,SET OF 6 T-LIGHTS SANTA,2.95,60,2011-01-16,2011-09-08,2.0
22435,SET OF 9 HEART SHAPED BALLOONS,1.25,109,2011-01-09,2011-09-30,3.5
20966,SANDWICH BATH SPONGE,1.25,59,2011-01-10,2011-08-24,3.25
20963,APPLE BATH SPONGE,1.25,50,2011-01-09,2011-09-09,3.0
20961,STRAWBERRY BATH SPONGE ,1.25,142,2011-01-16,2011-09-09,3.0
22068,BLACK PIRATE TREASURE CHEST,1.65,224,2011-01-09,2011-09-07,4.0
21743,STAR PORTABLE TABLE LIGHT ,2.95,196,2011-01-17,2011-09-13,5.0
21744,SNOWFLAKE PORTABLE TABLE LIGHT ,2.95,193,2011-10-09,2011-09-05,2.75
84709B,PINK OVAL JEWELLED MIRROR,5.95,239,2011-01-24,2011-06-26,2.0
21592,RETROSPOT CIGAR BOX MATCHES ,1.25,210,2011-01-15,2011-09-09,3.0
21587,COSY HOUR GIANT TUBE MATCHES,2.55,104,2011-10-15,2010-12-09,4.5
20992,JAZZ HEARTS PURSE NOTEBOOK,0.85,134,2011-01-10,2011-09-09,1.75
22804,CANDLEHOLDER PINK HANGING HEART,2.95,219,2011-01-09,2011-09-07,4.5
20749,ASSORTED COLOUR MINI CASES,7.95,155,2011-01-09,2011-09-08,2.0
22382,LUNCH BAG SPACEBOY DESIGN ,1.65,77,2011-01-09,2011-09-09,3.5
20726,LUNCH BAG WOODLAND,1.65,166,2011-01-09,2011-09-09,1.5
22384,LUNCH BAG PINK POLKADOT,1.65,111,2011-01-09,2011-09-09,4.25
22467,GUMBALL COAT RACK,2.55,235,2011-01-09,2011-09-09,1.0
84625C,BLUE NEW BAROQUE CANDLESTICK CANDLE,2.95,205,2011-01-13,2011-09-09,1.5
84625A,PINK NEW BAROQUECANDLESTICK CANDLE,2.95,165,2011-01-13,2011-09-06,3.25
21108,FAIRY CAKE FLANNEL ASSORTED COLOUR,2.55,181,2011-01-10,2011-09-07,3.25
22848,BREAD BIN DINER STYLE PINK,16.95,183,2011-01-09,2011-09-09,2.25
47570B,TEA TIME TABLE CLOTH,10.65,216,2011-01-09,2011-03-06,2.25
22837,HOT WATER BOTTLE BABUSHKA ,4.25,141,2011-01-09,2011-09-25,4.0
22297,HEART IVORY TRELLIS SMALL,1.25,232,2011-01-09,2011-09-08,2.0
22772,PINK DRAWER KNOB ACRYLIC EDWARDIAN,1.25,171,2011-01-10,2011-09-09,3.75
22773,GREEN DRAWER KNOB ACRYLIC EDWARDIAN,1.25,219,2011-01-09,2011-09-09,1.25
22805,BLUE DRAWER KNOB ACRYLIC EDWARDIAN,1.25,141,2011-01-09,2011-09-09,4.5
21125,SET 6 FOOTBALL CELEBRATION CANDLES,1.25,240,2011-01-09,2011-09-08,3.25
21126,SET OF 6 GIRLS CELEBRATION CANDLES,1.25,87,2011-01-09,2011-09-09,2.25
85049C,ROMANTIC PINKS RIBBONS ,1.25,189,2011-01-09,2011-09-08,3.25
85049D,BRIGHT BLUES RIBBONS ,1.25,195,2011-01-09,2011-09-28,4.25
85049G,CHOCOLATE BOX RIBBONS ,1.25,144,2011-01-09,2011-09-08,1.5
21061,PARTY INVITES FOOTBALL,0.85,182,2011-01-13,2011-09-28,1.25
21063,PARTY INVITES JAZZ HEARTS,0.85,180,2011-01-09,2011-09-27,4.25
21062,PARTY INVITES SPACEMAN,0.85,188,2011-01-11,2011-09-05,4.0
84380,SET OF 3 BUTTERFLY COOKIE CUTTERS,1.25,143,2011-01-10,2011-09-08,2.75
84378,SET OF 3 HEART COOKIE CUTTERS,1.25,200,2011-01-09,2011-09-08,2.0
22964,3 PIECE SPACEBOY COOKIE CUTTER SET,2.1,225,2011-01-09,2011-09-08,2.25
21213,PACK OF 72 SKULL CAKE CASES,0.55,134,2011-01-11,2011-09-09,1.5
22417,PACK OF 60 SPACEBOY CAKE CASES,0.55,245,2011-01-09,2011-09-09,2.0
84992,72 SWEETHEART FAIRY CAKE CASES,0.55,168,2011-01-09,2011-09-09,4.75
22383,LUNCH BAG SUKI  DESIGN ,1.65,142,2011-01-09,2011-09-09,1.25
20728,LUNCH BAG CARS BLUE,1.65,151,2011-01-09,2011-09-09,3.75
20727,LUNCH BAG  BLACK SKULL.,1.65,86,2011-01-09,2011-09-09,5.0
22296,HEART IVORY TRELLIS LARGE,1.65,154,2011-01-09,2011-09-08,1.5
20914,SET/5 RED RETROSPOT LID GLASS BOWLS,2.55,73,2011-01-09,2011-09-09,1.5
22537,MAGIC DRAWING SLATE DINOSAUR,0.42,118,2011-01-11,2011-09-07,3.25
22533,MAGIC DRAWING SLATE BAKE A CAKE ,0.42,189,2011-01-09,2011-09-09,5.0
20982,12 PENCILS TALL TUBE SKULLS,0.85,222,2011-01-10,2011-09-09,1.5
21915,RED  HARMONICA IN BOX ,1.25,137,2011-01-09,2011-09-09,1.5
21914,BLUE HARMONICA IN BOX ,1.25,193,2011-01-09,2011-09-09,5.0
21544,SKULLS  WATER TRANSFER TATTOOS ,0.85,106,2011-01-09,2011-09-08,2.75
22813,PACK 3 BOXES BIRD PANNETONE ,1.95,171,2011-01-09,2011-09-09,3.0
84375,SET OF 20 KIDS COOKIE CUTTERS,2.1,104,2011-01-09,2011-09-09,3.0
22418,10 COLOUR SPACEBOY PEN,0.85,173,2011-01-10,2011-09-09,2.5
22178,VICTORIAN GLASS HANGING T-LIGHT,1.25,224,2011-01-09,2011-09-09,1.75
84970L,SINGLE HEART ZINC T-LIGHT HOLDER,0.95,93,2011-01-09,2011-09-09,3.5
22465,HANGING METAL STAR LANTERN,1.65,117,2011-01-11,2011-09-29,1.5
84949,SILVER HANGING T-LIGHT HOLDER,1.65,151,2011-01-09,2011-09-08,2.25
20685,DOORMAT RED RETROSPOT,7.95,197,2011-01-10,2011-09-09,2.0
48194,DOORMAT HEARTS,7.95,166,2011-01-09,2011-09-09,4.75
22488,NATURAL SLATE RECTANGLE CHALKBOARD,1.65,97,2011-01-09,2011-09-09,2.25
22219,LOVEBIRD HANGING DECORATION WHITE ,0.85,143,2011-01-09,2011-09-09,4.5
22610,PENS ASSORTED FUNNY FACE,0.85,112,2011-01-09,2011-09-08,1.5
22716,CARD CIRCUS PARADE,0.42,239,2011-01-09,2011-09-07,1.0
22706,WRAP COWBOYS  ,0.42,250,2011-01-23,2011-09-09,4.0
22371,AIRLINE BAG VINTAGE TOKYO 78,4.25,180,2011-01-09,2011-09-08,2.75
21210,SET OF 72 RETROSPOT PAPER  DOILIES,1.45,95,2011-01-09,2011-09-09,4.0
16237,SLEEPING CAT ERASERS,0.21,142,2011-01-09,2011-09-07,4.75
22714,CARD BIRTHDAY COWBOY,0.42,67,2011-01-13,2011-09-09,1.75
22812,PACK 3 BOXES CHRISTMAS PANNETONE,1.95,70,2011-01-09,2011-09-09,3.75
84347,ROTATING SILVER ANGELS T-LIGHT HLDR,2.55,227,2011-01-09,2011-09-09,1.25
22736,RIBBON REEL MAKING SNOWMEN ,1.65,81,2011-01-09,2011-09-06,2.5
22620,4 TRADITIONAL SPINNING TOPS,1.25,145,2011-01-09,2011-09-08,1.25
21705,BAG 500g SWIRLY MARBLES,1.65,132,2011-01-15,2011-09-08,4.0
90199C,5 STRAND GLASS NECKLACE CRYSTAL,6.35,243,2011-11-28,2011-09-29,1.75
22785,SQUARECUSHION COVER PINK UNION FLAG,6.75,177,2011-01-09,2011-09-27,4.0
22975,SPACEBOY CHILDRENS EGG CUP,1.25,67,2011-01-09,2011-09-08,4.75
22972,CHILDREN'S SPACEBOY MUG,1.65,82,2011-01-09,2011-09-08,3.75
22568,FELTCRAFT CUSHION OWL,3.75,177,2011-01-09,2011-09-09,1.25
85116,BLACK CANDELABRA T-LIGHT HOLDER,2.1,198,2011-01-09,2011-09-08,5.0
22664,TOY TIDY DOLLY GIRL DESIGN,2.1,194,2011-01-09,2011-09-07,4.5
21609,SET 12 LAVENDER  BOTANICAL T-LIGHTS,2.95,81,2011-01-11,2011-08-05,3.5
21866,UNION JACK FLAG LUGGAGE TAG,1.25,210,2011-01-10,2011-09-08,2.5
20669,RED HEART LUGGAGE TAG,1.25,124,2011-01-13,2011-09-28,2.25
90129F,RED GLASS TASSLE BAG CHARM,2.95,215,2011-10-18,2011-09-21,4.5
90210B,CLEAR ACRYLIC FACETED BANGLE,2.95,117,2011-10-26,2011-09-29,3.0
21955,DOORMAT UNION JACK GUNS AND ROSES,7.95,150,2011-01-09,2011-09-07,4.0
72802C,VANILLA SCENT CANDLE JEWELLED BOX,4.25,184,2011-01-10,2011-09-08,3.5
22109,FULL ENGLISH BREAKFAST PLATE,3.75,235,2011-01-10,2011-09-09,4.25
22531,MAGIC DRAWING SLATE CIRCUS PARADE  ,0.42,117,2011-01-09,2011-09-09,2.5
21811,CHRISTMAS HANGING HEART WITH BELL,1.25,178,2011-01-11,2011-09-30,2.75
22183,CAKE STAND VICTORIAN FILIGREE MED,6.75,103,2011-01-09,2011-07-15,1.75
21678,PAISLEY PATTERN  STICKERS,0.85,62,2011-01-09,2011-09-28,3.0
21676,FLOWERS  STICKERS,0.85,119,2011-01-09,2011-09-28,3.25
85169B,BLACK LOVE BIRD CANDLE,1.25,120,2011-01-09,2011-09-25,1.75
16238,PARTY TIME PENCIL ERASERS,0.21,160,2011-01-09,2011-09-29,1.5
84906,PINK B'FLY C/COVER W BOBBLES,5.95,244,2011-01-13,2011-06-02,1.5
21867,PINK UNION JACK  LUGGAGE TAG,1.25,123,2011-01-17,2011-09-07,3.0
22075,6 RIBBONS ELEGANT CHRISTMAS ,1.65,232,2011-01-13,2011-09-07,2.75
21326,AGED GLASS SILVER T-LIGHT HOLDER,0.65,181,2011-01-09,2011-09-09,3.25
21065,BOOM BOX SPEAKER GIRLS,5.95,219,2011-01-09,2011-09-27,2.25
22074,6 RIBBONS SHIMMERING PINKS ,1.65,91,2011-01-09,2011-09-09,4.25
20713,JUMBO BAG OWLS,1.95,248,2011-01-09,2011-09-09,4.0
21116,OWL DOORSTOP,4.95,136,2011-01-10,2011-09-08,4.75
21824,PAINTED METAL STAR WITH HOLLY BELLS,1.45,198,2011-01-09,2011-09-04,3.0
21823,PAINTED METAL HEART WITH HOLLY BELL,1.45,151,2011-01-09,2011-09-04,2.25
22153,ANGEL DECORATION STARS ON DRESS,0.42,175,2011-01-03,2011-09-09,2.25
85099F,JUMBO BAG STRAWBERRY,1.95,75,2011-01-09,2011-09-09,2.0
20717,STRAWBERRY SHOPPER BAG,1.25,223,2011-01-09,2011-09-09,2.25
22328,ROUND SNACK BOXES SET OF 4 FRUITS ,2.95,228,2011-01-09,2011-09-09,4.75
22327,ROUND SNACK BOXES SET OF 4 SKULLS,2.95,191,2011-01-10,2011-09-09,5.0
22630,DOLLY GIRL LUNCH BOX,1.95,94,2011-01-09,2011-09-09,5.0
21245,GREEN POLKADOT PLATE ,1.69,62,2011-01-09,2011-09-29,2.75
21244,BLUE POLKADOT PLATE ,1.69,167,2011-01-09,2011-09-09,2.75
21242,RED RETROSPOT PLATE ,1.69,54,2011-01-09,2011-09-08,1.5
21243,PINK  POLKADOT PLATE ,1.69,200,2011-01-09,2011-09-06,2.0
22273,FELTCRAFT DOLL MOLLY,2.95,147,2011-01-10,2011-09-09,2.25
22940,FELTCRAFT CHRISTMAS FAIRY,4.25,50,2011-01-11,2011-09-09,4.75
22759,SET OF 3 NOTEBOOKS IN PARCEL,1.65,80,2011-01-10,2011-09-09,4.25
21880,RED RETROSPOT TAPE,0.65,104,2011-01-09,2011-09-09,1.0
21738,COSY SLIPPER SHOES SMALL  RED ,2.95,249,2011-01-10,2011-08-05,1.0
22077,6 RIBBONS RUSTIC CHARM,1.65,234,2011-01-09,2011-09-09,1.75
21448,12 DAISY PEGS IN WOOD BOX,1.65,186,2011-01-09,2011-09-09,4.75
