StockCode,Description,UnitPrice,QuantityAvailable,Product_Created,Product_lastUpdated,Ratings
84859C,PINK DISCO HANDBAG,5.95,226,2011-10-12,2011-09-28,3.5
79406,FROSTED WHITE BASE ,0.22,70,2011-11-02,2011-08-18,5.0
22980,PANTRY SCRUBBING BRUSH,1.65,193,2011-10-10,2011-09-09,4.75
22993,SET OF 4 PANTRY JELLY MOULDS,1.25,232,2011-10-09,2011-09-09,4.5
23006,TRAVEL CARD WALLET FLOWER MEADOW,0.42,239,2011-10-13,2011-09-09,2.75
23004,TRAVEL CARD WALLET PANTRY,0.42,186,2011-10-09,2011-09-09,3.75
23002,TRAVEL CARD WALLET SKULLS,0.42,222,2011-10-11,2011-09-09,2.25
23003,TRAVEL CARD WALLET VINTAGE ROSE ,0.42,123,2011-02-15,2011-06-08,3.25
23000,TRAVEL CARD WALLET TRANSPORT,0.42,148,2011-10-11,2011-09-09,1.5
22994,TRAVEL CARD WALLET RETROSPOT,0.42,97,2011-10-10,2011-09-09,2.0
22998,TRAVEL CARD WALLET KEEP CALM,0.42,240,2011-10-09,2011-09-09,3.5
22991,GIRAFFE WOODEN RULER,1.95,163,2011-10-09,2011-09-05,4.75
22992,REVOLVER WOODEN RULER ,1.95,63,2011-10-09,2011-09-07,2.25
22999,TRAVEL CARD WALLET RETRO PETALS,0.36,190,2011-10-11,2011-09-09,3.5
22995,TRAVEL CARD WALLET SUKI,0.36,163,2011-10-13,2011-09-09,4.75
22996,TRAVEL CARD WALLET VINTAGE TICKET,0.36,246,2011-10-09,2011-09-08,3.75
22978,PANTRY ROLLING PIN,3.75,219,2011-10-09,2011-09-09,4.0
22997,TRAVEL CARD WALLET UNION JACK,0.42,52,2011-10-13,2011-09-09,3.75
23005,TRAVEL CARD WALLET I LOVE LONDON,0.42,126,2011-10-09,2011-09-09,2.25
79062D,"RETRO TIN ASHTRAY,REVOLUTIONARY",0.65,83,2011-02-16,2011-08-16,1.0
20837,FRENCH FLORAL CUSHION COVER ,2.95,57,2011-10-01,2011-07-27,4.0
47341A,FUSCHIA TABLE RUN FLOWER ,3.75,141,2011-02-16,2011-06-08,1.75
21087,SET/6 POSIES PAPER CUPS,0.83,174,2011-02-17,2011-04-07,4.5
37491D,PURPLE/BLUE CERAMIC CANDLE HOLDER,3.29,165,2011-02-17,2011-07-18,2.5
44092C,PURPLE/COPPER HANGING LAMPSHADE,0.85,65,2011-10-19,2011-09-05,3.5
79331,PINK FLOCK GLASS CANDLEHOLDER,1.65,55,2011-02-19,2011-04-07,4.25
84306,S/3 PINK SQUARE PLANTERS ROSES,10.95,97,2011-02-19,2011-03-09,3.5
44092B,BLUE WHITE PLASTIC RINGS LAMPSHADE,0.85,242,2011-02-19,2011-09-05,4.0
90065A,WHITE VINTAGE CRYSTAL BRACELET,6.75,101,2011-02-19,2011-06-26,2.75
90026D,GLASS BEAD HOOP NECKLACE AMETHYST,8.5,156,2011-11-17,2011-03-31,1.0
90000A,RASPBERRY ANT COPPER FLOWER NECKLAC,5.95,222,2011-10-10,2011-06-26,2.25
90026C,GLASS BEAD HOOP NECKLACE GREEN,8.5,179,2011-11-08,2011-07-06,3.75
90026B,GLASS BEAD HOOP NECKLACE MONTANA,8.5,142,2011-02-19,2011-03-31,1.5
35638A,PINK AND BLACK STRING CURTAIN,5.95,175,2011-10-20,2011-08-07,4.75
84691,PACK 20 DOLLY PEGS,0.72,68,2011-02-20,2011-05-31,4.75
85065,CREAM SWEETHEART TRAYS,12.75,90,2011-02-21,2011-02-22,1.0
21414,SCALLOP SHELL SOAP DISH,2.1,177,2011-02-21,2011-02-22,4.5
84858C,PINK RIVIERA HANDBAG,11.63,180,2011-02-21,2011-04-13,1.0
84466,TOP SECRET PEN SET,1.25,199,2011-02-22,2011-07-14,1.5
84687,BEACH HUT SHELF W 3 DRAWERS,11.63,235,2011-10-23,2011-08-04,5.0
90100,NECKLACE+BRACELET SET PINK DAISY,2.55,66,2011-02-23,2011-02-24,4.25
84809B,PINK CHRYSANTHEMUMS ART FLOWER,2.1,147,2011-02-24,2011-06-20,3.0
72140E,BEST DAD CANDLE LETTERS,0.85,237,2011-10-15,2011-06-08,4.25
10080,GROOVY CACTUS INFLATABLE,0.85,155,2011-10-09,2011-09-08,3.25
17001,HEAVENS SCENT FRAGRANCE OILS ASSTD,0.29,83,2011-02-27,2011-02-28,2.5
71050,SMALL SINGLE FLAME CANDLE HOLDER,0.35,136,2011-10-26,2011-02-28,1.25
90124A,PINK MURANO TWIST NECKLACE,9.98,214,2011-10-22,2011-05-25,2.75
90135,ORANGE/WHT/FUSCHIA STONES NECKLACE,4.98,93,2011-02-27,2011-04-26,1.0
90157,RIVIERA NECKLACE,4.98,93,2011-11-16,2011-06-29,2.75
90176A,CLASSIC DIAMANTE NECKLACE JET,7.48,89,2011-11-02,2011-02-28,4.5
90176C,DIAMANTE NECKLACE,8.32,209,2011-02-27,2011-08-22,4.25
90177A,CLASSIC DIAMANTE EARRINGS JET,2.9,240,2011-10-11,2011-09-23,3.25
90187A,BLUE DROP EARRINGS W BEAD CLUSTER,3.32,142,2011-02-27,2011-02-28,1.0
90001A,ANTIQUE RASPBERRY FLOWER EARRINGS,4.15,209,2011-10-30,2011-06-13,4.0
84802B,PURPLE ANEMONE ARTIFICIAL FLOWER,1.69,210,2011-02-28,2011-03-01,2.5
84803B,WHITE ALLIUM  ARTIFICIAL FLOWER,1.69,59,2011-02-28,2011-08-10,1.75
23182,TOILET SIGN OCCUPIED OR VACANT,0.83,91,2011-10-09,2011-09-09,4.0
20796,SMALL BLUE PROVENCAL CERAMIC BALL,1.65,127,2011-10-30,2011-09-08,4.75
22979,PANTRY WASHING UP BRUSH,1.45,232,2011-10-09,2011-09-09,4.25
23177,TREASURE ISLAND BOOK BOX,2.25,185,2011-10-10,2011-09-07,3.25
23193,BUFFALO BILL TREASURE BOOK BOX,2.25,50,2011-10-09,2011-09-05,1.75
23194,GYMKHANNA TREASURE BOOK BOX,2.25,227,2011-10-10,2011-09-08,2.75
23176,ABC TREASURE BOOK BOX ,2.25,209,2011-10-10,2011-09-08,1.5
22982,PANTRY PASTRY BRUSH,1.25,88,2011-10-09,2011-09-08,4.5
23126,DOLLCRAFT GIRL AMELIE KIT,4.95,182,2011-10-09,2011-09-08,4.0
23127,DOLLCRAFT GIRL NICOLE,4.95,250,2011-10-09,2011-09-08,4.0
16020C,CLEAR STATIONERY BOX SET ,0.85,178,2011-03-01,2011-07-05,1.5
90016C,SILVER/BLACK PENDANT ORBIT NECKLACE,8.32,193,2011-12-07,2011-06-14,4.0
90025D,BAROQUE BUTTERFLY EARRINGS PINK,3.73,54,2011-03-02,2011-09-29,2.0
23128,FELTCRAFT BOY JEAN-PAUL KIT,4.95,95,2011-10-10,2011-09-08,5.0
23183,MOTHER'S KITCHEN SPOON REST ,3.75,104,2011-10-09,2011-09-08,2.75
23179,CLOCK MAGNET MUM'S KITCHEN,2.89,102,2011-10-11,2011-09-27,4.25
23178,JAM CLOCK MAGNET,2.89,54,2011-10-09,2011-09-06,3.75
22981,PANTRY APPLE CORER,1.45,116,2011-10-09,2011-09-06,4.0
37423,WHITE WITH BLACK CATS PLATE,0.85,58,2011-03-17,2011-03-08,4.75
23180,MUM'S KITCHEN CLOCK,4.95,188,2011-10-26,2011-09-08,3.5
23049,RECYCLED ACAPULCO MAT RED,8.25,109,2011-10-10,2011-09-07,1.25
23053,RECYCLED ACAPULCO MAT PINK,8.25,64,2011-10-17,2011-09-07,2.0
23054,RECYCLED ACAPULCO MAT LAVENDER,8.25,175,2011-10-26,2011-09-07,1.25
23050,RECYCLED ACAPULCO MAT GREEN,8.25,169,2011-10-10,2011-09-04,1.5
23052,RECYCLED ACAPULCO MAT TURQUOISE,8.25,159,2011-10-10,2011-09-07,2.75
23051,RECYCLED ACAPULCO MAT BLUE,8.25,108,2011-10-17,2011-09-04,1.75
79026B,"S/4 ICON COASTER,ELVIS LIVES",1.25,118,2011-03-03,2011-05-04,4.25
23185,FRENCH STYLE STORAGE JAR JAM,1.25,188,2011-10-10,2011-09-05,3.5
23184,BULL DOG BOTTLE OPENER,4.95,250,2011-10-09,2011-09-09,1.25
90084,PINK CRYSTAL GUITAR PHONE CHARM,0.85,195,2011-03-05,2011-03-06,2.5
35607B,BLACK FEATHER CHRISTMAS DECORATION,0.19,101,2011-03-05,2011-09-16,2.75
90038C,GLASS AND BEADS BRACELET IVORY,3.75,220,2011-03-06,2011-09-02,4.75
62096B,PURPLE/TURQ FLOWERS HANDBAG,1.25,70,2011-03-06,2011-03-07,2.75
GIFT_0001_10,Dotcomgiftshop Gift Voucher 10.00,8.33,63,,,4.5
84593,CROCHET ROSE DES CLOTHES HANGER,2.95,181,2011-03-06,2011-03-07,3.5
16248B,BLUE HOLE PUNCH,1.25,163,2011-10-24,2011-09-12,1.0
21841,BABY MOUSE RED GINGHAM DRESS,4.25,187,2011-10-15,2011-09-26,2.0
23181,BULL DOG BOTTLE TOP WALL CLOCK,8.25,191,2011-10-17,2011-09-08,4.25
23187,FRENCH STYLE STORAGE JAR BONBONS,1.25,185,2011-10-09,2011-09-09,1.75
23186,FRENCH STYLE STORAGE JAR CAFE ,1.25,197,2011-10-10,2011-09-07,3.5
84086B,YELLOW/BLUE RETRO RADIO,2.95,52,2011-11-16,2011-07-20,3.5
79063C,"RETRO PILL BOX KEY CHAIN,THE KING",0.19,217,2011-10-12,2011-09-22,2.75
23010,CIRCUS PARADE BABY GIFT SET,16.95,151,2011-10-10,2011-09-06,2.75
23007, SPACEBOY BABY GIFT SET,16.95,122,2011-10-10,2011-09-30,4.0
35611B,thrown away,0.0,192,2011-03-08,2011-03-09,3.5
23009,I LOVE LONDON BABY GIFT SET,14.95,149,2011-10-10,2011-09-05,2.0
23008,DOLLY GIRL BABY GIFT SET,14.95,171,2011-10-10,2011-09-30,1.0
72140F,throw away,0.0,165,2011-03-08,2011-03-09,3.0
84535A,ENGLISH ROSE NOTEBOOK A6 SIZE,0.65,76,2011-03-09,2011-05-08,1.75
16202A,PASTEL PINK PHOTO ALBUM ,0.5,198,2011-03-10,2011-04-17,3.5
21395,BLUE POLKADOT BEAKER ,1.63,194,2011-10-20,2011-08-04,2.25
85098B,BLUE FLYING SINGING CANARY,3.75,163,2011-03-12,2011-03-13,2.75
84842,HELLO SAILOR BATHROOM SET,3.75,175,2011-11-19,2011-08-01,3.75
84227,HEN HOUSE W CHICK IN NEST,0.42,166,2011-03-13,2011-03-14,4.0
16161G,WRAP BAD HAIR DAY,0.1,219,2011-10-17,2011-09-07,1.75
16259,PIECE OF CAMO STATIONERY SET,0.21,56,2011-10-09,2011-09-05,3.5
47013A,WINE BOTTLE DRESSING LT.BLUE,0.29,91,2011-03-16,2011-04-03,2.75
22687,DOORMAT CHRISTMAS VILLAGE,15.79,78,2011-10-24,2011-09-07,5.0
84977,WIRE FLOWER T-LIGHT HOLDER,1.25,155,2011-03-17,2011-03-18,3.0
84968B,SET OF 16 VINTAGE IVORY CUTLERY,12.75,62,2011-03-17,2011-04-06,2.5
90075,MONTANA DIAMOND CLUSTER NECKLACE,8.95,125,2011-11-23,2011-03-29,4.75
90068,"RUBY GLASS NECKLACE 42""",7.5,201,2011-03-17,2011-03-18,4.75
35910B,PINK FLOWERS RABBIT EASTER,1.95,215,2011-11-05,2011-03-29,5.0
84750A,PINK SMALL GLASS CAKE STAND,1.95,247,2011-03-19,2011-04-08,3.0
78033,FLAG OF ST GEORGE CHAIR,5.95,92,2011-10-05,2011-09-14,2.75
37488A,YELLOW PINK FLOWER DESIGN BIG BOWL,0.39,248,2011-03-19,2011-04-04,4.75
85030,FRENCH CHATEAU OVAL PLATTER,1.95,221,2011-03-19,2011-04-08,3.75
21637,ASSORTED SANSKRIT MINI NOTEBOOK,1.25,231,2011-10-09,2011-07-28,3.5
47344B,BLUE FLOWER DES PURSE,1.25,57,2011-03-19,2011-06-02,5.0
46126A,ELVIS WALLHANGING / CURTAIN,1.25,240,2011-03-20,2011-05-05,3.0
90182B,AMETHYST 3 BEAD DROP EARRINGS,2.9,154,2011-11-15,2011-03-22,1.0
37330,BIG POLKADOT MUG,0.39,145,2011-03-21,2011-03-22,4.25
90124C,GREEN MURANO TWIST NECKLACE,9.98,100,2011-10-22,2011-09-12,1.25
90131,PINK/AMETHYST/GOLD NECKLACE,6.95,135,2011-03-22,2011-06-01,2.25
85224,ASSORTED COLOUR SILK GLASSES CASE,2.1,102,2011-03-22,2011-03-23,4.0
72759,thrown away-can't sell.,0.0,186,2011-03-22,2011-03-23,2.0
72732,thrown away-can't sell,0.0,237,2011-03-22,2011-03-23,1.25
23077,DOUGHNUT LIP GLOSS ,1.25,232,2011-10-09,2011-09-09,1.5
23076,ICE CREAM SUNDAE LIP GLOSS,1.25,53,2011-10-09,2011-09-09,4.0
23078,ICE CREAM PEN LIP GLOSS ,1.25,61,2011-10-09,2011-09-08,3.0
21770,OPEN CLOSED METAL SIGN,4.95,138,2011-10-09,2011-09-09,4.25
47013C,WINE BOTTLE DRESSING DARK BLUE,0.29,148,2011-03-23,2011-06-07,3.25
84548,CROCHET BEAR RED/BLUE  KEYRING,1.65,236,2011-03-23,2011-07-08,3.25
15030,FAN BLACK FRAME ,0.29,173,2011-10-29,2011-09-28,4.5
23159,SET OF 5 PANCAKE DAY MAGNETS,2.08,114,2011-10-09,2011-09-09,2.25
23154,SET OF 4 JAM JAR MAGNETS,2.08,183,2011-10-10,2011-09-09,3.25
23156,SET OF 5 MINI GROCERY MAGNETS,2.08,158,2011-10-09,2011-09-09,1.75
23155,KNICKERBOCKERGLORY MAGNET ASSORTED ,0.83,218,2011-10-09,2011-09-09,2.0
84569C,PACK 4 FLOWER/BUTTERFLY PATCHES,1.25,78,2011-03-24,2011-03-25,5.0
23158,SET OF 5 LUCKY CAT MAGNETS ,1.85,218,2011-10-09,2011-09-09,4.25
85145,JARDIN ETCHED GLASS LARGE BELL JAR,12.75,86,2011-03-24,2011-04-07,2.25
21839,MUMMY MOUSE RED GINGHAM RIBBON,5.45,146,2011-03-26,2011-03-27,2.75
85028S,FRENCH CHATEAU SMALL FRUITBOWL,1.95,173,2011-03-26,2011-04-08,1.25
85028L,FRENCH CHATEAU LARGE FRUIT BOWL ,1.95,211,2011-03-26,2011-04-08,2.0
84856S,SMALL TAHITI BEACH BAG,4.65,50,2011-03-29,2011-04-14,3.75
20821,GOLDIE LOOKING MIRROR,4.95,148,2011-11-22,2011-08-25,3.25
84743C,ORANGE FELT VASE + FLOWERS,1.25,143,2011-03-30,2011-04-05,2.0
23157,SET OF 6 NATIVITY MAGNETS ,2.08,159,2011-10-09,2011-09-08,3.25
21614,SET OF 12 ROSE BOTANICAL T-LIGHTS,5.79,60,2011-03-30,2011-05-05,1.5
84549,CROCHET WHITE RABBIT KEYRING ,3.29,244,2011-11-07,2011-07-28,4.25
90014C,SILVER/BLACK ORBIT NECKLACE,9.95,234,2011-11-24,2011-08-18,1.25
35649,VINTAGE BEAD COSMETIC BAG ,3.35,207,2011-10-17,2011-09-07,2.75
35809B,ENAMEL BLUE RIM TEA CONTAINER,0.83,227,2011-04-09,2011-04-04,3.5
84686,BEACH HUT MIRROR,4.25,76,2011-04-03,2011-07-06,2.25
84576,BLUE CAT BISCUIT BARREL PINK HEART,4.13,61,2011-04-18,2011-07-07,1.0
84877A,PINK ROUND COMPACT MIRROR,1.25,111,2011-04-05,2011-06-13,4.75
84875D,BLUE SQUARE COMPACT MIRROR,1.25,167,2011-04-05,2011-09-05,1.0
23254,CHILDRENS CUTLERY DOLLY GIRL ,4.15,214,2011-10-09,2011-09-09,3.0
23256,CHILDRENS CUTLERY SPACEBOY ,4.15,164,2011-10-09,2011-09-09,5.0
90024D,NEW BAROQUE B'FLY NECKLACE PINK,8.5,52,2011-04-09,2011-09-29,4.75
23255,CHILDRENS CUTLERY CIRCUS PARADE,4.15,142,2011-10-09,2011-09-04,1.25
22039,BOTANICAL LILY GIFT WRAP,0.42,210,2011-10-24,2011-09-30,2.25
90025A,BAROQUE BUTTERFLY EARRINGS BLACK,3.75,167,2011-10-08,2011-04-10,2.75
37487B,YELLOW/ORANGE FLOWER DESIGN PLATE,0.29,128,2011-04-10,2011-04-13,4.75
84839,SWEETHEART KEY CABINET,5.55,203,2011-04-10,2011-04-11,3.75
23205,CHARLOTTE BAG VINTAGE ALPHABET ,0.85,172,2011-10-09,2011-09-09,2.0
23201,JUMBO BAG ALPHABET,2.08,195,2011-10-09,2011-09-09,1.5
23207,LUNCH BAG ALPHABET DESIGN,1.65,156,2011-10-09,2011-09-09,2.0
23199,JUMBO BAG APPLES,2.08,140,2011-10-09,2011-09-09,3.0
23206,LUNCH BAG APPLE DESIGN,1.65,102,2011-10-09,2011-09-09,2.5
23204,CHARLOTTE BAG APPLES DESIGN,0.85,227,2011-10-09,2011-09-09,4.25
23208,LUNCH BAG VINTAGE LEAF DESIGN,1.65,86,2011-10-09,2011-09-08,3.75
84689,S/2 BEACH HUT TREASURE CHESTS,5.95,217,2011-04-11,2011-05-04,2.5
44242B,PINK FEATHERS CURTAIN,1.25,222,2011-04-13,2011-09-26,1.0
PADS,PADS TO MATCH ALL CUSHIONS,0.001,165,2011-04-14,2011-09-25,4.25
84731,3 BIRDS CANVAS SCREEN,1.65,110,2011-04-14,2011-07-31,2.5
23065,LARGE DECO JEWELLERY STAND,12.5,136,2011-10-09,2011-09-09,3.75
16202B,PASTEL BLUE PHOTO ALBUM ,0.5,87,2011-04-16,2011-04-19,3.25
23060,HEART BEADED TRELLIS DECORATION,2.08,191,2011-10-19,2011-09-04,3.25
23057,GEMSTONE CHANDELIER T-LIGHT HOLDER,4.15,247,2011-10-13,2011-09-06,2.25
23253,16 PIECE CUTLERY SET PANTRY DESIGN,33.29,233,2011-10-10,2011-09-28,1.5
23348,CHILDRENS TOY COOKING UTENSIL SET,4.13,99,2011-10-09,2011-09-09,1.5
90181C,BLACK GLASS/SHELL/PEARL NECKLACE,9.15,236,2011-04-17,2011-04-18,3.0
23066,SMALL DECO JEWELLERY STAND,8.25,127,2011-10-12,2011-09-09,3.0
23068,ALUMINIUM STAMPED HEART,2.49,113,2011-10-12,2011-09-08,3.75
23075,DOUBLE CERAMIC PARLOUR HOOK,4.15,129,2011-10-11,2011-09-06,4.75
23153,ZINC SWEETHEART WIRE LETTER RACK,3.75,148,2011-10-09,2011-09-07,2.5
90036C,"FLOWER GLASS GARLAND NECKL.36""BLUE",7.9,60,2011-10-26,2011-05-09,4.25
23073,GEORGIAN TRINKET BOX,12.5,212,2011-10-11,2011-09-09,4.75
90135A,ORANGE/FUSCHIA STONES NECKLACE,4.98,228,2011-04-18,2011-04-19,2.75
90159,COTE D'AZURE NECKLACE,4.98,225,2011-10-30,2011-06-29,3.5
23146,TRIPLE HOOK ANTIQUE IVORY ROSE,3.29,68,2011-10-09,2011-09-08,4.5
23061,VINTAGE EMBOSSED HEART,1.25,56,2011-10-09,2011-09-08,2.0
20823,GOLD WINE GOBLET,0.79,142,2011-04-18,2011-06-09,3.25
20827,GOLD APERITIF GLASS,0.39,78,2011-04-18,2011-04-21,4.25
23055,IVORY CHANDELIER T-LIGHT HOLDER,6.25,134,2011-10-13,2011-09-06,2.5
23056,FLOWERS CHANDELIER T-LIGHT HOLDER,6.25,190,2011-10-13,2011-09-06,4.75
20997,ROSE DU SUD CUSHION COVER ,4.13,227,2011-10-30,2011-09-09,4.25
23140,TRIPLE WIRE HOOK IVORY HEART,4.15,108,2011-10-10,2011-09-08,4.5
23141,TRIPLE WIRE HOOK PINK HEART,4.15,206,2011-10-18,2011-08-22,3.0
23135,SMALL ZINC HEART WALL ORGANISER,5.75,167,2011-10-24,2011-09-28,1.75
23132,SMALL IVORY HEART WALL ORGANISER,5.75,133,2011-10-10,2011-09-07,2.75
23071,MARIE ANTOIENETT TRINKET BOX GOLD,12.5,183,2011-10-13,2011-09-28,4.75
23152,IVORY SWEETHEART WIRE LETTER RACK ,3.75,233,2011-10-09,2011-09-09,4.25
23134,LARGE ZINC HEART WALL ORGANISER,7.05,228,2011-04-19,2011-09-08,4.0
23133,LARGE IVORY HEART WALL ORGANISER,7.05,100,2011-10-10,2011-09-08,1.0
84990,60 GOLD AND SILVER FAIRY CAKE CASES,0.55,239,2011-04-19,2011-05-08,1.0
23147,SINGLE ANTIQUE ROSE HOOK IVORY,1.45,124,2011-10-09,2011-09-08,1.75
23148,MINIATURE ANTIQUE ROSE HOOK IVORY,0.83,180,2011-10-11,2011-09-09,1.0
23144,ZINC T-LIGHT HOLDER STARS SMALL,0.72,171,2011-10-09,2011-09-09,2.0
23142,IVORY WIRE KITCHEN ORGANISER,10.4,168,2011-10-23,2011-09-08,4.0
23136,IVORY WIRE SWEETHEART LETTER TRAY,3.75,178,2011-10-10,2011-09-08,1.75
23139,SINGLE WIRE HOOK PINK HEART,1.45,114,2011-10-12,2011-09-23,1.5
23138,SINGLE WIRE HOOK IVORY HEART,1.45,247,2011-10-12,2011-09-08,3.75
23150,IVORY SWEETHEART SOAP DISH,2.49,249,2011-10-12,2011-09-06,4.75
23145,ZINC T-LIGHT HOLDER STAR LARGE,0.95,184,2011-10-10,2011-09-09,2.25
90025B,BAROQUE BUTTERFLY EARRINGS RED,3.73,110,2011-04-20,2011-04-21,4.0
23137,ZINC WIRE SWEETHEART LETTER TRAY,3.75,240,2011-10-09,2011-09-04,5.0
72024U,LILAC VOTIVE CANDLE,0.21,138,2011-04-25,2011-06-27,4.75
16049,TEATIME GEL PENS ASST,0.42,171,2011-04-25,2011-05-05,4.5
23069,EDWARDIAN PHOTO FRAME,6.25,214,2011-10-13,2011-09-26,4.75
16244B,MAXWELL 2 TONE BLUE 60 PAGE PHOTO A,0.5,230,2011-04-25,2011-05-11,2.5
23131,MISTLETOE HEART WREATH CREAM,4.15,84,2011-10-09,2011-09-09,2.0
23067,HANGING ENGRAVED METAL HEART,4.15,144,2011-10-12,2011-09-07,2.75
47341B,BLUE TABLE RUN FLOWER,1.25,85,2011-10-23,2011-09-08,2.75
62097B,BLUE STRIPES SHOULDER BAG,0.83,106,2011-04-26,2011-05-23,1.75
62043B,BLUE CHECK BAG W HANDLE 34X20CM,0.83,158,2011-04-26,2011-05-19,2.25
90021,LASER CUT MULTI STRAND NECKLACE,11.95,162,2011-04-26,2011-04-27,2.25
23163,REGENCY SUGAR TONGS,2.49,141,2011-10-09,2011-09-09,3.0
23284,DOORMAT KEEP CALM AND COME IN,6.75,195,2011-10-09,2011-09-30,1.5
23283,DOORMAT VINTAGE LEAVES DESIGN ,7.95,153,2011-10-10,2011-09-30,3.25
23162,REGENCY TEA STRAINER,3.75,234,2011-10-10,2011-09-06,2.75
84016,FLAG OF ST GEORGE CAR FLAG,0.83,210,2011-04-26,2011-09-14,2.5
DCGS0004,HAYNES CAMPER SHOULDER BAG,16.63,67,2011-04-26,2011-04-27,4.5
20838,FRENCH LATTICE CUSHION COVER ,3.29,122,2011-10-11,2011-09-09,1.25
72811,SMALL ZINC/GLASS CANDLEHOLDER,1.25,241,2011-11-01,2011-08-17,4.25
20816,GOLD FLOWER CUSHION COVER ,1.95,199,2011-04-27,2011-04-28,3.75
23048,SET OF 10 LANTERNS FAIRY LIGHT STAR,4.15,66,2011-10-10,2011-09-05,3.25
23042,PAPER LANTERN 7 POINT SNOW STAR,6.65,135,2011-10-20,2011-09-29,2.75
23041,PAPER LANTERN 9 POINT SNOW STAR,4.15,64,2011-10-10,2011-09-05,3.0
23040,PAPER LANTERN 9 POINT SNOW STAR ,5.75,76,2011-10-09,2011-09-05,2.0
23064,CINDERELLA CHANDELIER ,49.95,238,2011-10-11,2011-09-08,4.0
85225,BLING KEY RING STAND,1.25,159,2011-12-05,2011-04-28,3.0
37471,MULTICOLOUR POLKADOT PLATE,6.63,153,2011-10-11,2011-06-10,2.25
23130,MISTLETOE HEART WREATH GREEN,4.15,77,2011-10-09,2011-09-09,2.0
84629,WHITE 3 FRAME BIRDS AND TREE ,21.95,61,2011-04-30,2011-08-16,3.75
22987,WRAP SUMMER ROSE DESIGN,0.42,228,2011-10-09,2011-09-02,1.5
20836,FRENCH PAISLEY CUSHION COVER,0.83,217,2011-10-01,2011-09-05,3.75
23160,REGENCY TEA SPOON,1.04,170,2011-10-16,2011-09-09,1.0
23161,REGENCY CAKE FORK,1.04,131,2011-10-09,2011-09-09,4.75
23164,REGENCY CAKE SLICE,4.15,117,2011-10-10,2011-09-09,4.25
23149,ANTIQUE IVORY WIRE BOWL SMALL,2.49,239,2011-10-12,2011-09-23,1.0
84705C,PINK FLOCK PHOTO FRAME ,1.25,161,2011-05-02,2011-05-03,2.0
23143,ZINC WIRE KITCHEN ORGANISER,10.4,206,2011-11-14,2011-08-02,2.0
23299,FOOD COVER WITH BEADS SET 2 ,3.75,244,2011-10-09,2011-09-09,4.75
23298,SPOTTY BUNTING,4.95,198,2011-10-09,2011-09-09,3.25
23070,EDWARDIAN HEART PHOTO FRAME,4.15,112,2011-10-12,2011-09-06,3.75
23151,ZINC SWEETHEART SOAP DISH,2.49,59,2011-10-12,2011-09-06,2.5
90058A,CRYSTAL STUD EARRINGS CLEAR DISPLAY,0.38,99,2011-10-17,2011-07-03,2.5
23043,PAPER LANTERN 9 POINT HOLLY STAR 40,6.25,85,2011-10-11,2011-09-27,4.25
23045,PAPER LANTERN 5 POINT STAR MOON 30,4.15,144,2011-10-18,2011-09-05,2.75
20964,POLYESTER FILLER PAD 60x40cm,2.55,238,2011-05-05,2011-05-06,1.25
23200,mailout ,0.0,183,2011-10-09,2011-09-09,2.5
23202,mailout,0.0,188,2011-10-09,2011-09-09,4.25
23203,mailout,0.0,116,2011-10-09,2011-09-09,5.0
84859B,BLUE DISCO HANDBAG,1.95,244,2011-10-19,2011-09-30,4.25
23209,mailout,0.0,63,2011-10-09,2011-09-09,2.25
23072,MARIE ANTOINETTE TRINKET BOX SILVER,12.5,161,2011-10-10,2011-09-29,4.0
23046,PAPER LANTERN 9 POINT DELUXE STAR,6.65,226,2011-10-09,2011-09-06,3.5
23047,PAPER LANTERN 5 POINT SEQUIN STAR,5.75,77,2011-10-12,2011-09-06,3.0
23044,PAPER LANTERN 9 POINT HOLLY STAR S,4.15,127,2011-10-11,2011-09-27,3.75
90036A,FLOWER GARLAND NECKLACE RED,7.95,237,2011-05-07,2011-08-05,3.75
90083,CRYSTAL CZECH CROSS PHONE CHARM,1.63,59,2011-11-13,2011-06-29,2.5
23282,FOLDING BUTTERFLY MIRROR IVORY ,0.83,190,2011-10-16,2011-09-07,2.0
23280,FOLDING BUTTERFLY MIRROR HOT PINK ,0.83,73,2011-10-12,2011-09-08,2.5
23190,BUNDLE OF 3 SCHOOL EXERCISE BOOKS  ,1.65,244,2011-10-09,2011-09-09,2.5
23191,BUNDLE OF 3 RETRO NOTE BOOKS,1.65,83,2011-10-09,2011-09-08,1.5
23192,BUNDLE OF 3 ALPHABET EXERCISE BOOKS,1.65,163,2011-10-09,2011-09-09,4.0
23175,REGENCY MILK JUG PINK ,3.25,101,2011-10-09,2011-09-09,2.0
23174,REGENCY SUGAR BOWL GREEN,4.15,85,2011-10-09,2011-09-09,4.0
23173,REGENCY TEAPOT ROSES ,8.15,129,2011-10-09,2011-09-09,3.75
23172,REGENCY TEA PLATE PINK,1.65,207,2011-10-09,2011-09-09,3.0
23171,REGENCY TEA PLATE GREEN ,1.65,51,2011-10-09,2011-09-09,3.5
23170,REGENCY TEA PLATE ROSES ,1.65,151,2011-10-09,2011-09-09,1.25
23081,GREEN METAL BOX ARMY SUPPLIES,8.25,187,2011-10-09,2011-09-09,3.5
23084,RABBIT NIGHT LIGHT,2.08,217,2011-10-09,2011-09-09,1.5
23281,FOLDING BUTTERFLY MIRROR RED  ,0.83,63,2011-10-16,2011-09-08,3.0
23118,PARISIENNE JEWELLERY DRAWER ,7.5,233,2011-10-09,2011-09-09,3.5
23096,PETIT TRAY CHIC,1.65,65,2011-10-09,2011-09-08,3.25
23091,ZINC HERB GARDEN CONTAINER,6.25,110,2011-10-09,2011-09-09,1.25
23094,LE GRAND TRAY CHIC SET,12.5,54,2011-10-10,2011-09-05,3.5
23108,SET OF 10 LED DOLLY LIGHTS,6.25,167,2011-10-09,2011-09-09,3.75
23080,RED METAL BOX TOP SECRET,8.25,158,2011-10-09,2011-09-08,5.0
23110,PARISIENNE KEY CABINET ,5.75,234,2011-10-09,2011-09-09,4.5
23059,Thrown away-rusty,0.0,206,2011-05-10,2011-05-11,3.75
23100,SILVER BELLS TABLE DECORATION,1.25,185,2011-10-09,2011-09-09,4.75
23102,SILVER HEARTS TABLE DECORATION,0.83,61,2011-10-09,2011-09-06,3.0
23082,SET 6 PAPER TABLE LANTERN HEARTS ,3.75,193,2011-10-09,2011-09-09,3.5
16151A,FLOWERS HANDBAG blue and orange,1.25,223,2011-05-10,2011-05-25,4.5
23093,SMALL PARISIENNE HEART PHOTO FRAME ,2.49,236,2011-10-09,2011-09-06,3.0
23109,LED TEA LIGHTS,2.49,124,2011-10-09,2011-09-09,2.0
23103,BELL HEART DECORATION,1.65,188,2011-10-09,2011-09-09,4.0
23112,PARISIENNE CURIO CABINET,7.5,165,2011-10-09,2011-09-09,4.0
23111,PARISIENNE SEWING BOX,12.5,172,2011-10-09,2011-09-09,3.0
23079,TOADSTOOL BEDSIDE LIGHT ,8.95,179,2011-10-10,2011-09-08,4.25
23167,SMALL CERAMIC TOP STORAGE JAR ,0.69,51,2011-10-09,2011-09-09,4.0
23104,IVORY PANTRY HANGING LAMP ,12.5,176,2011-10-15,2011-09-21,4.0
23168,CLASSIC SUGAR DISPENSER,1.25,149,2011-10-09,2011-09-09,4.5
23169,CLASSIC GLASS SWEET JAR,4.15,142,2011-10-09,2011-09-09,4.25
23165,LARGE CERAMIC TOP STORAGE JAR,1.45,55,2011-10-09,2011-09-07,2.25
23101,SILVER STARS TABLE DECORATION,0.83,221,2011-10-09,2011-09-09,1.25
23089,GLASS BON BON JAR,1.65,130,2011-10-09,2011-09-07,4.75
23107,WHITE WIRE PLANT POT HOLDER,2.89,215,2011-10-09,2011-09-28,3.25
23088,ZINC HEART FLOWER T-LIGHT HOLDER,2.46,68,2011-10-09,2011-09-07,3.75
23106,ZINC HEARTS PLANT POT HOLDER,2.89,221,2011-10-12,2011-09-15,2.75
23087,ZINC  HEART T-LIGHT HOLDER,1.25,240,2011-10-11,2011-09-08,3.5
90035C,"PEARL & SHELL 42""NECKL. IVORY",10.75,168,2011-05-12,2011-05-13,4.0
23083,SET 6 PAPER TABLE LANTERN STARS ,3.75,120,2011-10-09,2011-09-09,3.0
23301,GARDENERS KNEELING PAD KEEP CALM ,1.65,170,2011-10-09,2011-09-09,4.25
23300,GARDENERS KNEELING PAD CUP OF TEA ,1.45,63,2011-10-09,2011-09-08,4.25
23302,KNEELING MAT HOUSEWORK  DESIGN,1.65,112,2011-10-09,2011-09-08,2.75
47574B,ENGLISH ROSE SCENTED HANGING HEART,4.25,206,2011-05-14,2011-05-18,2.75
23090,VINTAGE GLASS T-LIGHT HOLDER,0.83,188,2011-10-10,2011-09-07,3.0
23092,LARGE ANTIQUE WHITE PHOTO FRAME,7.9,75,2011-10-09,2011-09-08,3.25
23085,ANTIQUE SILVER BAUBLE LAMP  ,10.4,55,2011-10-10,2011-09-09,2.5
23099,FRENCH CARRIAGE LANTERN,6.65,72,2011-10-09,2011-09-07,1.75
23086,ZINC  STAR T-LIGHT HOLDER ,1.25,167,2011-10-16,2011-09-08,4.75
84873A,FUNKY FLOWER PICNIC BAG FOR 4,16.95,84,2011-05-16,2011-06-01,4.75
23129,HEART SHAPED HOLLY WREATH,4.15,199,2011-10-09,2011-09-09,4.75
90081B,LILY BROOCH WHITE/SILVER COLOUR,4.95,81,2011-05-17,2011-05-18,4.5
84804B,BLUE DELPHINIUM ARTIFICIAL FLOWER,2.95,73,2011-12-05,2011-09-27,3.0
84984B,RED PEONY CUSHION COVER ,4.65,196,2011-11-07,2011-09-09,1.75
84984A,GREEN PEONY CUSHION COVER,4.65,75,2011-11-07,2011-09-09,5.0
90149,SILVER FLOWR PINK SHELL NECKLACE,7.5,176,2011-12-01,2011-09-30,4.0
21310,CAPIZ CHANDELIER,29.95,104,2011-05-23,2011-05-24,2.5
90018C,SILVER BLACK ORBIT DROP EARRINGS,4.15,134,2011-10-11,2011-09-06,1.75
23228,FILIGREE HEART BIRD WHITE ,1.25,236,2011-10-09,2011-09-09,1.5
23227,FILIGREE HEART BUTTERFLY WHITE ,1.25,230,2011-10-12,2011-09-08,1.0
23444,Next Day Carriage,15.0,202,2011-10-09,2011-09-09,1.5
20667,CHERRY BLOSSOM PURSE,2.95,248,2011-05-30,2011-08-08,3.0
23226,FILIGREE HEART DAISY WHITE,1.25,141,2011-10-13,2011-09-08,3.0
23221,REINDEER HEART DECORATION SILVER,1.63,93,2011-10-09,2011-09-08,2.25
84206C,CHAMPAGNE TRAY BLANK CARD,0.19,76,2011-11-24,2011-06-01,4.5
23214,JINGLE BELL HEART ANTIQUE GOLD,2.08,243,2011-10-12,2011-09-07,4.5
23215,JINGLE BELL HEART ANTIQUE SILVER,2.08,83,2011-10-09,2011-09-09,4.5
23210,WHITE ROCKING HORSE HAND PAINTED,1.25,172,2011-10-10,2011-09-07,3.75
23213,STAR WREATH DECORATION WITH BELL,1.25,237,2011-10-10,2011-09-08,5.0
23212,HEART WREATH DECORATION WITH BELL,1.25,243,2011-10-10,2011-09-07,4.75
23219,LAUREL STAR ANTIQUE SILVER ,1.25,112,2011-10-10,2011-09-04,4.0
23224,CHERUB HEART DECORATION GOLD,0.83,55,2011-10-09,2011-09-30,4.0
23211,RED ROCKING HORSE HAND PAINTED,1.04,60,2011-10-09,2011-09-07,2.5
23216,LAUREL HEART ANTIQUE GOLD,1.04,248,2011-10-10,2011-09-23,1.0
23217,LAUREL HEART ANTIQUE SILVER,1.04,189,2011-10-09,2011-09-08,1.5
23225,CHERUB HEART DECORATION SILVER ,0.72,212,2011-10-09,2011-09-08,2.5
84805B,wet damaged,0.0,93,2011-12-05,2011-09-16,2.5
23275,SET OF 3 HANGING OWLS OLLIE BEAK,1.25,133,2011-10-09,2011-09-09,1.0
23263,SET OF 3 WOODEN HEART DECORATIONS,1.25,159,2011-10-09,2011-09-09,2.5
23309,SET OF 60 I LOVE LONDON CAKE CASES ,0.55,200,2011-10-09,2011-09-08,1.5
23270,SET OF 2 CERAMIC PAINTED HEARTS ,1.45,224,2011-10-09,2011-09-06,4.75
23307,SET OF 60 PANTRY DESIGN CAKE CASES ,0.55,193,2011-10-09,2011-09-09,3.5
23306,SET OF 36 DOILIES PANTRY DESIGN,1.45,179,2011-10-09,2011-09-08,3.25
23308,SET OF 60 VINTAGE LEAF CAKE CASES ,0.55,82,2011-10-09,2011-09-09,2.0
23273,HEART T-LIGHT HOLDER WILLIE WINKIE,1.65,123,2011-10-09,2011-09-07,2.75
23274,STAR T-LIGHT HOLDER WILLIE WINKIE,1.65,59,2011-10-09,2011-09-09,2.25
90025E,BAROQUE BUTTERFLY EARRINGS MONTANA,3.73,140,2011-06-05,2011-06-06,3.75
21373,MIRRORED WALL ART SNOWFLAKES,0.75,105,2011-10-10,2011-09-08,1.25
16043,POP ART PUSH DOWN RUBBER ,0.12,103,2011-06-06,2011-06-09,3.25
