StockCode,Description,UnitPrice,QuantityAvailable,Product_Created,Product_lastUpdated,Ratings
22598,CHRISTMAS MUSICAL ZINC TREE,0.85,130,2011-10-09,2011-09-26,3.0
22532,MAGIC DRAWING SLATE LEAP FROG ,0.42,147,2011-01-16,2011-09-09,3.5
21413,PERIWINKLE T-LIGHT HOLDER,1.25,74,2011-01-18,2011-09-15,4.25
79149B,SILICON STAR BULB  BLUE,0.42,130,2011-11-17,2011-09-11,3.5
21682,LARGE MEDINA STAMPED METAL BOWL ,4.95,53,2011-01-15,2011-09-05,4.0
78034B,BLUE NETTING STORAGE HANGER,1.95,111,2011-10-01,2011-08-02,1.5
22894,TABLECLOTH RED APPLES DESIGN ,8.5,195,2011-01-13,2011-09-23,2.25
79151B,"SILICON CUBE 25W, BLUE",0.42,249,2011-11-27,2010-12-05,2.25
21090,SET/6 COLLAGE PAPER PLATES,0.85,212,2011-01-11,2011-09-05,2.75
21209,MULTICOLOUR HONEYCOMB FAN,1.65,202,2011-01-09,2011-09-04,1.5
22354,RETROSPOT PADDED SEAT CUSHION,3.75,158,2011-01-09,2011-09-04,2.75
21635,MADRAS NOTEBOOK LARGE ,3.75,197,2010-12-04,2011-07-04,5.0
35653,VINTAGE BEAD NOTEBOOK,2.95,151,2011-01-11,2011-08-11,2.25
85130D,BEADED CRYSTAL HEART PINK LARGE,1.65,221,2011-01-09,2011-09-05,3.25
15039,SANDALWOOD FAN,0.85,211,2011-01-11,2011-09-08,2.0
84978,HANGING HEART JAR T-LIGHT HOLDER,1.25,158,2011-01-09,2011-09-09,2.0
84569D,PACK 6 HEART/ICE-CREAM PATCHES,1.25,95,2011-01-09,2011-09-07,4.75
84921,CREAM AND PINK FLOWERS PONY ,3.75,99,2011-10-15,2011-04-19,1.5
84508C,BLUE CIRCLES DESIGN TEDDY,2.55,168,2011-01-18,2011-09-25,2.5
90086,CRYSTAL FROG PHONE CHARM,0.85,59,2011-01-05,2011-09-26,2.25
62018,SOMBRERO ,1.95,97,2011-01-26,2011-09-22,2.25
16011,ANIMAL STICKERS,0.21,235,2011-01-09,2011-09-14,3.75
85179A,GREEN BITTY LIGHT CHAIN,4.65,174,2011-01-09,2011-07-28,4.75
21785,RAIN PONCHO ,0.85,125,2011-01-08,2011-02-15,2.25
21650,ASSORTED TUTTI FRUTTI BRACELET,0.65,248,2011-01-09,2011-09-07,3.5
84874B,BLUE TRAVEL FIRST AID KIT,1.65,122,2011-01-16,2011-08-02,1.75
22674,FRENCH TOILET SIGN BLUE METAL,1.25,56,2011-01-09,2011-09-09,3.0
72051S,BAG OF SILVER STONES,0.42,138,2011-01-16,2011-04-13,4.75
20764,ABSTRACT CIRCLES SKETCHBOOK ,3.75,167,2011-01-16,2011-09-04,2.25
47579,TEA TIME BREAKFAST BASKET,2.1,224,2010-12-04,2010-12-05,4.0
21723,ALPHABET HEARTS STICKER SHEET,0.85,64,2011-01-11,2011-09-09,3.25
35953,FOLKART STAR CHRISTMAS DECORATIONS,1.25,177,2011-10-09,2011-09-28,3.5
84051,ASS COLOUR GLOWING TIARAS,0.85,144,2011-01-16,2011-09-04,1.0
21187,WHITE BELL HONEYCOMB PAPER GARLAND ,1.65,181,2011-01-16,2011-08-04,4.25
21696,SMALL SILVER TRELLIS CANDLEPOT,2.95,131,2011-01-17,2011-09-28,2.75
22034,ROBIN CHRISTMAS CARD,0.42,94,2011-01-04,2010-12-05,3.25
20980,36 PENCILS TUBE POSY,1.25,185,2011-01-15,2011-08-08,2.5
35958,FOLKART ZINC STAR CHRISTMAS DEC,0.85,161,2010-12-04,2010-12-09,5.0
75013B,"STRING OF 8 BUTTERFLIES,PINK",1.65,79,2011-01-15,2010-12-06,2.5
22830,UTILTY CABINET WITH HOOKS,26.95,96,2011-01-15,2010-12-09,3.5
22684,FRENCH BLUE METAL DOOR SIGN 9,1.25,73,2011-01-09,2011-09-30,4.25
82011B,BATHROOM SCALES RUBBER DUCKS,3.75,81,2011-10-15,2011-09-29,1.0
21630,FLOOR CUSHION ELEPHANT CARNIVAL,8.95,68,2011-01-26,2011-09-29,2.25
21580,RABBIT  DESIGN  COTTON TOTE BAG,2.25,84,2011-01-22,2011-09-08,2.25
22231,JIGSAW TREE WITH BIRDHOUSE,1.45,154,2011-01-13,2011-09-04,1.5
22859,EASTER TIN BUNNY BOUQUET,1.65,164,2011-01-11,2011-09-15,3.75
22860,EASTER TIN CHICKS PINK DAISY,1.65,205,2011-01-15,2011-07-21,2.25
22093,MOTORING TISSUE BOX,1.25,95,2011-01-05,2011-09-08,4.75
20748,KENSINGTON COFFEE SET,12.75,79,2011-01-09,2011-09-05,2.25
85208,SET/12 FUNKY FELT FLOWER PEG IN BAG,2.1,72,2011-01-24,2011-09-28,4.75
22129,PARTY CONES CANDY TREE DECORATION,0.85,94,2011-01-04,2011-09-09,3.0
22808,SET OF 6 T-LIGHTS EASTER CHICKS,2.95,199,2011-01-09,2011-06-01,4.75
20702,PINK PADDED MOBILE,4.25,157,2011-01-25,2011-08-05,2.75
85187,S/12 MINI RABBIT EASTER,1.65,129,2011-01-13,2011-07-06,4.75
21683,MEDIUM MEDINA STAMPED METAL BOWL ,2.95,206,2011-01-17,2011-09-06,4.5
22770,MIRROR CORNICE,14.95,199,2011-01-25,2011-09-08,3.0
84563B,BLUE & WHITE BREAKFAST TRAY,5.95,186,2011-01-09,2011-09-22,1.25
79190A,RETRO PLASTIC 70'S TRAY,0.42,194,2011-01-16,2011-09-04,1.75
15034,PAPER POCKET TRAVELING FAN ,0.14,133,2011-01-09,2011-09-09,1.5
85129B,BEADED CRYSTAL HEART GREEN SMALL,1.25,172,2011-01-11,2011-09-26,2.25
35924,HANGING FAIRY CAKE DECORATION,2.1,89,2011-01-09,2011-09-23,1.25
20671,BLUE TEATIME PRINT BOWL ,1.25,70,2010-12-04,2010-12-09,4.5
21904,HOUSE WRECKING METAL SIGN ,2.1,173,2011-01-03,2011-05-05,3.75
22843,BISCUIT TIN VINTAGE GREEN,6.75,82,2011-01-20,2011-09-05,1.75
22199,FRYING PAN RED RETROSPOT,4.25,194,2011-01-09,2011-09-09,2.25
84968A,SET OF 16 VINTAGE ROSE CUTLERY,12.75,160,2011-01-09,2011-09-09,5.0
37509,NEW ENGLAND MUG W GIFT BOX,2.55,71,2010-12-04,2010-12-06,1.75
47369A,PINK GREEN EMBROIDERY COSMETIC BAG,2.95,68,2011-10-10,2011-07-08,4.5
47369B,BLUE GREEN EMBROIDERY COSMETIC BAG,2.95,234,2011-10-10,2011-09-21,5.0
47367B,PAIR PADDED HANGERS PINK CHECK,3.75,224,2011-01-11,2011-08-04,4.25
21695,SMALL SILVER FLOWER CANDLE POT,2.95,57,2011-01-23,2011-09-25,3.75
84773,RED ROSE AND LACE C/COVER,2.95,66,2010-12-04,2010-12-05,2.5
21424,WOODLAND STORAGE BOX LARGE ,2.95,128,2011-01-12,2011-09-07,1.5
21819,GLITTER CHRISTMAS STAR ,0.85,204,2011-01-03,2011-09-30,3.0
22817,CARD SUKI BIRTHDAY,0.42,149,2011-01-09,2011-09-09,2.5
16161U,WRAP SUKI AND FRIENDS,0.42,108,2011-01-10,2011-09-05,2.5
22252,BIRDCAGE DECORATION TEALIGHT HOLDER,1.25,63,2011-01-15,2011-09-09,4.0
21401,BLUE PUDDING SPOON,0.42,193,2011-01-23,2011-09-05,4.25
84597C,RETRO PINK BALL ASHTRAY ,1.25,199,2011-01-25,2011-06-02,2.75
51020A,SUMMER FUN DESIGN SHOWER CAP,1.25,128,2011-01-03,2011-04-03,1.75
51020B,STRIPY DESIGN SHOWER CAP,1.25,182,2011-01-11,2011-04-03,2.25
21306,SET/4 DAISY MIRROR MAGNETS,2.1,245,2011-01-10,2011-09-07,4.75
21311,SET/4 BIRD MIRROR MAGNETS ,2.1,115,2011-10-19,2011-09-09,1.25
21307,SET/4 BUTTERFLY MIRROR MAGNETS,2.1,247,2011-01-10,2011-07-08,3.5
21277,FRENCH STYLE EMBOSSED HEART CABINET,21.95,116,2011-01-10,2011-09-05,3.5
22475,SKULL DESIGN TV DINNER TRAY,4.95,148,2011-01-17,2011-09-06,4.75
90200E,GREEN SWEETHEART BRACELET,4.25,81,2011-01-09,2011-09-29,2.0
90062,CARNIVAL BRACELET,12.75,194,2011-01-09,2011-04-28,1.75
21616,4 PEAR BOTANICAL DINNER CANDLES,3.75,207,2011-01-09,2011-09-18,4.5
37461,FUNKY MONKEY MUG,1.25,191,2010-12-04,2010-12-05,5.0
20659,ECONOMY LUGGAGE TAG,1.25,198,2011-01-09,2011-09-28,2.75
20985,HEART CALCULATOR,1.25,170,2011-01-09,2011-09-29,2.75
84596L,BISCUITS SMALL BOWL LIGHT BLUE,1.25,132,2011-01-09,2011-09-04,2.25
84596F,SMALL MARSHMALLOWS PINK BOWL,1.25,53,2011-01-09,2011-09-09,2.25
22346,PARTY PIZZA DISH GREEN POLKADOT,0.85,174,2011-01-09,2011-08-18,4.0
22344,PARTY PIZZA DISH PINK POLKADOT,0.85,51,2011-01-09,2011-09-25,3.0
85215,ASSORTED CHEESE FRIDGE MAGNETS,0.65,179,2011-01-09,2011-09-16,3.25
85062,PEARL CRYSTAL PUMPKIN T-LIGHT HLDR,1.65,123,2011-01-12,2011-09-07,2.0
22984,CARD GINGHAM ROSE ,0.42,116,2011-01-10,2011-09-09,3.25
85036C,ROSE 1 WICK MORRIS BOXED CANDLE,4.25,249,2011-01-09,2011-09-25,2.75
21202,DOLLY HONEYCOMB GARLAND,1.65,92,2011-01-13,2011-09-28,1.5
84531A,PINK KNITTED EGG COSY,1.95,201,2010-12-04,2011-04-07,1.0
84531B,BLUE KNITTED EGG COSY,1.95,121,2010-12-04,2011-04-07,3.0
21910,WAY OUT METAL SIGN ,1.65,156,2011-01-24,2011-02-03,1.0
22461,SAVOY ART DECO CLOCK,12.75,217,2011-01-11,2011-09-14,4.5
22833,HALL CABINET WITH 3 DRAWERS,49.95,55,2011-01-11,2011-02-03,4.0
22690,DOORMAT HOME SWEET HOME BLUE ,7.95,52,2011-01-09,2011-09-09,1.75
84881,BLUE WIRE SPIRAL CANDLE HOLDER,6.35,65,2011-01-24,2011-07-17,1.5
21613,S/12 VANILLA  BOTANICAL T-LIGHTS,2.95,204,2011-01-18,2011-08-21,5.0
21693,SMALL HAMMERED SILVER CANDLEPOT ,2.95,168,2011-01-13,2011-09-30,3.0
84809A,WHITE CHRYSANTHEMUMS ART FLOWER,2.1,149,2010-12-04,2011-06-21,2.75
79190D,RETRO PLASTIC DAISY TRAY,0.42,212,2011-01-09,2011-09-04,1.5
22157,ANGEL DECORATION WITH LACE PADDED,0.85,188,2010-12-11,2011-08-31,3.75
84795B,SUNSET CHECK HAMMOCK,7.95,233,2011-01-30,2011-08-05,1.25
20771,CHRYSANTHEMUM  JOURNAL,2.55,62,2011-10-12,2011-09-23,2.5
37327,ASSTD MULTICOLOUR CIRCLES MUG,1.69,213,2011-01-09,2011-09-09,2.75
85027L,FRENCH CHATEAU LARGE PLATTER ,7.95,237,2011-01-30,2011-04-08,3.5
85017C,ENVELOPE 50 CURIOUS IMAGES,0.85,114,2010-12-04,2011-05-09,1.75
16010,FOLDING CAMPING SCISSOR W/KNIF & S,0.12,178,2010-12-04,2011-03-28,1.0
35001W,HAND OPEN SHAPE DECO.WHITE,3.49,114,2010-12-13,2010-12-09,2.25
84707B,PINK JEWELLED MIRROR TRINKET TRAY,9.95,81,2011-01-09,2011-09-06,3.75
21167,WHITE SAGE INCENSE,0.21,216,2011-01-20,2011-09-26,3.5
51008,AFGHAN SLIPPER SOCK PAIR,3.45,95,2011-01-11,2011-09-04,3.75
21713,CITRONELLA CANDLE FLOWERPOT,2.1,151,2011-01-13,2011-09-30,2.0
20802,SMALL GLASS SUNDAE DISH CLEAR,1.65,149,2011-01-17,2011-09-08,1.75
22052,VINTAGE CARAVAN GIFT WRAP,0.42,133,2011-01-16,2011-07-11,4.5
20781,GOLD EAR MUFF HEADPHONES,5.49,250,2011-01-18,2011-09-18,1.5
22389,PAPERWEIGHT SAVE THE PLANET,2.55,246,2011-01-18,2011-09-08,5.0
84840,SWEETHEART CARRY-ALL BASKET,8.5,187,2010-12-05,2011-03-25,4.5
22073,RED RETROSPOT STORAGE JAR,3.39,123,2011-01-09,2011-05-04,1.75
20716,PARTY FOOD SHOPPER BAG,2.51,187,2011-01-09,2011-06-03,3.5
20782,CAMOUFLAGE EAR MUFF HEADPHONES,11.02,79,2011-01-09,2011-09-22,5.0
20847,ZINC HEART LATTICE CHARGER LARGE,7.62,172,2011-01-19,2011-09-23,2.75
21291,SMALL POLKADOT CHOCOLATE GIFT BAG ,1.66,99,2011-01-22,2011-09-28,3.0
21319,GLASS CHALICE GREEN  SMALL ,3.36,174,2011-01-16,2011-04-07,2.5
21359,RELAX LARGE WOOD LETTERS,34.0,90,2011-01-13,2011-08-08,5.0
21397,BLUE POLKADOT EGG CUP ,3.36,204,2011-01-09,2011-06-03,4.75
21627,ELEPHANT CARNIVAL POUFFE,29.79,93,2011-01-10,2011-09-09,1.25
21632,VINTAGE PINK DECORATIVE PARASOL,25.49,117,2011-01-09,2010-12-06,1.25
22106,MIRROR MOSAIC HURRICANE LAMP ,5.06,157,2011-01-23,2011-09-02,1.0
22108,PING! MICROWAVE PLATE,3.36,166,2011-01-11,2011-09-26,2.0
22221,CAKE STAND LOVEBIRD 2 TIER PINK,20.38,166,2011-01-13,2011-09-25,5.0
22223,CAKE PLATE LOVEBIRD PINK,10.17,224,2011-01-09,2011-09-25,4.75
22282,12 EGG HOUSE PAINTED WOOD,25.49,147,2011-01-12,2011-09-09,3.0
22329,ROUND CONTAINER SET OF 5 RETROSPOT,3.36,69,2011-01-09,2011-09-08,4.75
22416,SET OF 36 DOILIES SPACEBOY DESIGN ,2.98,109,2011-01-16,2011-09-08,4.75
22613,PACK OF 20 SPACEBOY NAPKINS,1.66,195,2011-01-10,2011-09-07,5.0
35648,VINTAGE BEAD PINK PURSE ,5.91,179,2011-01-09,2011-09-07,4.75
35651,VINTAGE BEAD PINK SCARF ,16.13,158,2011-01-09,2011-09-08,1.0
37447,CERAMIC CAKE DESIGN SPOTTED PLATE,3.36,61,2011-01-13,2011-09-07,1.0
46118,FUNKY MONKEY CUSHION COVER,8.47,190,2011-01-09,2011-09-30,4.75
46776C,WOVEN FROST CUSHION COVER,4.21,53,2011-01-20,2011-09-09,1.5
46776E,WOVEN CANDY CUSHION COVER ,4.21,143,2011-01-09,2011-09-09,2.5
62094B,TURQ ICE CREAM BUM BAG ,5.06,209,2011-01-09,2011-02-04,4.5
84078A,SET/4 WHITE RETRO STORAGE CUBES ,76.55,57,2011-01-09,2011-09-30,3.75
84228,HEN HOUSE W CHICK STANDING,0.84,226,2011-01-16,2011-04-04,2.75
84568,GIRLS ALPHABET IRON ON PATCHES ,0.43,246,2011-01-09,2011-09-09,4.0
84789,ENCHANTED BIRD PLANT CAGE,7.62,119,2011-01-17,2011-07-21,2.5
84813,SET OF 4 DIAMOND NAPKIN RINGS,25.49,58,2011-01-09,2011-09-21,3.5
85093,CANDY SPOT EGG WARMER HARE,2.51,231,2011-01-27,2011-09-23,3.0
85096,HILDA CANDY SPOT RABBIT,7.62,176,2011-01-25,2011-08-09,3.5
85202,HANGING WOOD AND FELT HEART,0.84,124,2011-01-09,2011-09-09,4.75
85204,HANGING WOOD AND FELT FLOWER,0.84,158,2011-01-10,2011-09-07,4.0
90001D,ANTIQUE OLIVE GREEN FLOWER EARRINGS,4.24,145,2011-01-09,2011-08-25,1.75
90013C,GREEN VINTAGE EARRINGS ,4.24,225,2011-01-13,2011-09-05,2.75
90014B,GOLD M PEARL  ORBIT NECKLACE,10.62,69,2011-01-09,2011-08-30,3.5
90085,CRYSTAL STILETTO PHONE CHARM,1.66,96,2011-12-01,2011-08-05,1.0
90132,LIGHT TOPAZ TEAL/AQUA COL NECKLACE,5.09,166,2011-01-09,2011-08-30,3.75
90140,PINK SWEETIE NECKLACE,7.64,249,2010-12-05,2011-08-30,3.0
90141B,IVORY PENDANT TRIPLE SHELL NECKLACE,5.09,64,2011-01-09,2011-07-18,1.75
90158,ST TROPEZ NECKLACE,5.09,241,2011-01-12,2011-09-28,4.25
90183A,AMBER DROP EARRINGS W LONG BEADS,2.96,145,2011-01-16,2011-09-06,2.75
90183B,AMETHYST DROP EARRINGS W LONG BEADS,2.96,143,2011-01-16,2011-08-30,1.25
90201B,BLACK ENAMEL FLOWER RING,2.96,91,2011-01-11,2011-09-26,4.5
90212B,JET BLACK LAS VEGAS BRACELET ROUND,3.81,227,2011-01-17,2011-05-06,4.75
84712B,PINK JEWELLED PHOTO FRAME,7.95,242,2011-10-11,2011-09-05,4.0
22279,POCKET BAG BLUE PAISLEY RED SPOT,1.25,91,2011-01-09,2011-09-27,4.5
22280,POCKET BAG PINK PAISELY BROWN SPOT,1.25,200,2011-01-09,2011-09-29,4.75
22377,BOTTLE BAG RETROSPOT ,4.21,190,2011-01-09,2011-09-08,3.25
22495,SET OF 2 ROUND TINS CAMEMBERT ,5.91,216,2011-01-18,2011-09-07,4.5
22521,CHILDS GARDEN TROWEL PINK,1.66,162,2011-01-09,2011-05-05,4.25
22523,CHILDS GARDEN FORK PINK,1.66,215,2011-01-09,2011-09-28,1.25
22677,FRENCH BLUE METAL DOOR SIGN 2,2.51,189,2011-01-09,2011-09-30,3.25
22682,FRENCH BLUE METAL DOOR SIGN 7,2.51,91,2011-01-09,2011-09-08,5.0
22715,CARD WEDDING DAY,0.85,57,2011-01-09,2011-09-09,3.0
21253,SET OF PICTURE FRAME  STICKERS,5.91,168,2011-01-13,2011-09-07,3.0
21265,PINK GOOSE FEATHER TREE 60CM,5.91,111,2011-01-30,2011-09-29,4.25
21389,IVORY HANGING DECORATION  BIRD,1.66,186,2011-01-11,2011-09-29,4.25
21391,FRENCH LAVENDER SCENT HEART,4.21,214,2011-01-19,2011-09-07,2.5
21403,BLUE EGG  SPOON,0.85,192,2011-01-11,2011-09-07,4.0
21534,DAIRY MAID LARGE MILK JUG,10.17,147,2011-01-09,2011-09-07,4.0
21618,4 WILDFLOWER BOTANICAL CANDLES,7.62,67,2011-01-09,2011-08-30,4.0
21812,GARLAND WITH HEARTS AND BELLS,10.17,56,2011-01-11,2011-09-30,2.0
21847,GREEN  DIAMANTE PEN IN GIFT BOX,4.21,176,2011-01-09,2011-09-05,1.5
21943,CAKES AND RABBITS DESIGN FLANNEL ,1.66,73,2011-01-10,2011-09-27,4.0
22104,MIRROR MOSAIC CANDLE PLATE,1.66,189,2011-01-10,2011-09-08,4.75
22322,BIRD DECORATION GREEN POLKADOT,1.66,147,2011-01-09,2011-09-27,2.0
22340,NOEL GARLAND PAINTED ZINC ,3.36,177,2011-01-09,2011-09-29,2.5
35833G,4 GOLD FLOCK CHRISTMAS BALLS,3.36,196,2010-12-05,2010-12-06,3.5
35916A,YELLOW FELT HANGING HEART W FLOWER,1.66,110,2011-10-17,2011-08-30,3.75
46776A,WOVEN BUBBLE GUM CUSHION COVER,4.21,70,2011-01-09,2011-09-09,4.75
72351B,SET/6 PINK  BUTTERFLY T-LIGHTS,4.21,247,2011-01-10,2011-09-09,5.0
84459A,PINK METAL CHICKEN HEART ,3.36,50,2011-01-09,2011-08-04,1.0
84637,KITCHEN FLOWER POTS WALL PLAQUE,12.72,180,2011-01-09,2011-09-09,5.0
85039B,S/4 IVORY MINI ROSE CANDLE IN BOWL,1.66,132,2011-01-09,2011-09-09,4.0
85039C,S/4 BLACK MINI ROSE CANDLE IN BOWL,1.66,146,2011-01-09,2011-09-09,3.75
85131C,BEADED CRYSTAL HEART BLUE ON STICK,0.85,163,2011-01-09,2011-09-06,4.75
90010E,AMBER GLASS/SILVER BRACELET,9.34,153,2011-01-09,2011-09-09,1.0
90039C,FIRE POLISHED GLASS BRACELET BLACK,3.81,133,2011-01-12,2011-02-09,2.5
90056,CHUNKY CRACKED GLAZE NECKLACE IVORY,11.05,83,2011-12-04,2011-09-22,3.0
90081C,LILY BROOCH OLIVE COLOUR,5.09,165,2011-01-09,2011-08-21,3.25
90101,WHITE FRANGIPANI NECKLACE,2.54,137,2011-01-09,2011-09-23,3.0
90130B,TURQ STONE/CRYSTAL EARRINGS,2.96,188,2011-01-09,2011-09-09,4.5
90130C,GREEN STONE/CRYSTAL EARRINGS,2.96,249,2011-01-03,2011-08-05,3.75
15044C,PURPLE PAPER PARASOL,5.91,238,2011-01-16,2011-09-05,2.25
20762,GREEN FERN SKETCHBOOK ,7.62,163,2011-01-16,2011-09-04,1.5
20803,SMALL PINK GLASS SUNDAE DISH,3.36,216,2011-01-12,2011-05-16,4.75
18007,ESSENTIAL BALM 3.5g TIN IN ENVELOPE,0.18,161,2011-01-10,2011-07-20,1.0
21720,CAKE SHOP  STICKER SHEET,0.85,150,2011-01-13,2011-07-26,5.0
84968F,SET OF 16 VINTAGE SKY BLUE CUTLERY,12.75,95,2011-01-09,2011-09-07,3.5
21289,LARGE STRIPES CHOCOLATE GIFT BAG,1.25,223,2011-01-13,2011-09-07,3.75
22606,WOODEN SKITTLES GARDEN SET,15.95,136,2011-01-13,2011-09-05,5.0
37479B,CUBIC MUG FLOCK BLUE ON BROWN,2.55,62,2011-01-26,2011-06-08,1.25
37482P,CUBIC MUG PINK POLKADOT,2.55,72,2011-01-09,2011-04-08,4.25
20903,VINTAGE KEEPSAKE BOX TRAVELOGUE,6.35,117,2011-01-17,2011-08-09,5.0
20897,VINTAGE NOTEBOOK PARIS DAYS,2.95,187,2011-01-04,2011-08-05,4.75
71403,"PINK/WHITE ""KEEP CLEAN"" BULLET BIN",2.95,91,2011-01-09,2011-09-07,1.25
22683,FRENCH BLUE METAL DOOR SIGN 8,1.25,216,2011-01-09,2011-09-09,1.75
22685,FRENCH BLUE METAL DOOR SIGN 0,1.25,192,2011-01-09,2011-09-27,3.75
21973,SET OF 36 MUSHROOM PAPER DOILIES,1.45,65,2011-01-10,2011-09-04,1.75
22691,DOORMAT WELCOME SUNRISE,7.95,69,2011-10-16,2011-09-07,3.5
21162,TOXIC AREA  DOOR HANGER ,1.45,122,2011-01-11,2011-09-08,2.0
84926D,LA PALMIERA TILE COASTER,1.25,156,2011-01-04,2011-09-05,3.5
22233,JIGSAW RABBIT AND BIRDHOUSE,1.65,67,2011-01-10,2011-09-05,2.5
35400,WOODEN BOX ADVENT CALENDAR ,8.95,103,2011-01-11,2011-03-20,3.75
22486,PLASMATRONIC LAMP,12.75,205,2011-01-17,2011-09-08,2.0
72801G,4 BURGUNDY WINE DINNER CANDLES,1.25,126,2011-01-08,2011-09-01,4.0
84711A,SILVER OVAL SHAPE TRINKET BOX,9.95,130,2011-01-09,2011-09-21,5.0
16169N,WRAP BLUE RUSSIAN FOLKART,0.42,136,2010-12-05,2010-12-06,1.75
20769,DAISY JOURNAL ,2.55,157,2011-01-16,2011-09-28,3.5
35597A,DUSTY PINK CHRISTMAS TREE 30CM,1.25,224,2010-12-05,2010-12-06,1.75
47480,HANGING PHOTO CLIP ROPE LADDER,1.65,53,2011-01-09,2011-09-09,2.25
84522,PINK PARTY SUNGLASSES,1.95,134,2011-11-21,2011-08-12,2.75
20731,POSY CANDY BAG,1.25,222,2011-01-29,2011-06-09,4.0
35597B,BLACKCHRISTMAS TREE 30CM,1.25,68,2010-12-05,2010-12-06,1.75
84596B,SMALL DOLLY MIX DESIGN ORANGE BOWL,1.25,213,2011-01-09,2011-09-09,1.75
21226,POCKET MIRROR WOODLAND,1.25,128,2011-10-19,2011-07-08,1.25
79160,HEART SHAPE WIRELESS DOORBELL,2.1,209,2011-01-11,2011-08-05,2.5
72131,COLUMBIAN CANDLE RECTANGLE,1.95,174,2011-10-10,2011-09-19,3.0
21089,SET/6 GREEN SPRING PAPER CUPS,0.65,90,2010-12-05,2011-09-22,1.5
21647,ASSORTED TUTTI FRUTTI LARGE PURSE,2.1,207,2011-10-16,2011-09-30,4.5
72122,COFFEE SCENT PILLAR CANDLE,0.95,130,2011-01-11,2011-09-18,5.0
84912A,PINK ROSE WASHBAG,3.75,138,2011-01-22,2011-09-22,2.5
85036A,GARDENIA 1 WICK MORRIS BOXED CANDLE,4.25,54,2011-01-19,2011-09-04,1.0
21692,SILVER LATTICE VANILLA CANDLE POT,3.75,164,2011-01-26,2011-02-25,4.25
84569A,PACK 3 IRON ON DOG PATCHES,1.25,236,2011-01-11,2011-09-29,1.0
20775,DAISY NOTEBOOK ,1.65,84,2011-01-09,2011-09-07,3.25
90179C,BLACK FINE BEAD NECKLACE W TASSEL,5.95,140,2011-11-28,2011-08-16,4.5
90060D,FIRE POLISHED GLASS NECKL BRONZE,5.95,74,2010-12-09,2010-12-06,4.5
85020,ROUND PINK HEART MIRROR,2.1,189,2011-01-20,2011-08-03,2.5
20861,GOLD COSMETIC BAG PINK STAR,2.1,58,2010-12-09,2010-12-06,5.0
21827,EIGHT PIECE CREEPY CRAWLIE SET,1.25,84,2010-12-05,2011-03-29,5.0
79051A,SMOKEY GREY COLOUR D.O.F. GLASS,0.65,248,2011-10-11,2011-09-28,1.5
17007B,S/3 POT POURI CUSHIONS BLUE COLOURS,2.1,167,2010-12-05,2011-06-08,5.0
22700,BLACK AND WHITE DOG BOWL,2.95,152,2011-01-09,2011-08-24,1.25
10124A,SPOTS ON RED BOOKCOVER TAPE,0.42,243,2011-11-05,2011-03-27,2.75
21644,ASSORTED TUTTI FRUTTI HEART BOX,1.25,109,2011-01-09,2011-09-06,1.0
46000P,POLYESTER FILLER PAD 65CMx65CM,4.25,247,2011-01-06,2011-09-04,2.25
22681,FRENCH BLUE METAL DOOR SIGN 6,1.25,106,2011-01-09,2011-09-30,2.75
21746,SMALL RED RETROSPOT WINDMILL,1.25,224,2011-01-10,2011-09-07,4.25
84916,HAND TOWEL PALE BLUE W FLOWERS,5.95,237,2011-01-09,2011-05-04,4.0
40005B,BLUE ORGANDY ROUND LAMPSHADE W BEA,0.85,173,2011-11-21,2011-09-14,2.25
18094C,WHITE AND BLUE CERAMIC OIL BURNER,1.25,113,2011-01-09,2011-09-07,1.25
22085,PAPER CHAIN KIT SKULLS ,2.95,153,2011-01-12,2011-09-06,4.75
47586A,PINK FAIRY CAKE CUSHION COVER,2.55,106,2011-01-24,2011-09-16,4.75
46115B,GREEN POP ART MAO CUSHION COVER ,0.19,103,2010-12-05,2011-03-04,1.25
84975,HEART SHAPED MIRROR,1.69,118,2010-12-05,2010-12-08,3.0
21336,GOLD WASHBAG,2.95,89,2010-12-05,2011-06-29,1.75
22050,PINK PAISLEY ROSE GIFT WRAP,0.42,190,2011-01-09,2011-09-07,3.0
21680,WOODLAND  STICKERS,0.85,131,2011-01-09,2011-09-09,4.75
20819,SILVER TEDDY BEAR,3.75,197,2011-01-10,2011-09-08,1.5
84925F,PSYCHEDELIC WALL THERMOMETER,2.55,73,2011-01-25,2011-07-07,1.75
22535,MAGIC DRAWING SLATE BUNNIES ,0.42,188,2011-01-09,2011-09-09,2.25
84968E,check,0.0,66,2011-01-09,2011-09-04,4.5
16169K,WRAP FOLK ART,0.42,85,2011-01-09,2011-09-04,5.0
21001,ROSE DU SUD WASHBAG ,4.21,127,2011-01-11,2011-09-05,2.25
21028,NINJA RABBIT BLACK,2.51,76,2011-01-09,2011-09-05,2.0
21171,BATHROOM METAL SIGN ,3.36,169,2011-01-10,2011-08-11,2.75
21204,DAISIES  HONEYCOMB GARLAND ,3.36,119,2011-01-10,2011-09-05,1.25
21222,SET/4 BADGES BEETLES,2.51,71,2011-01-09,2011-09-04,2.0
21251,DINOSAUR HEIGHT CHART STICKER SET,5.91,92,2011-01-09,2011-09-28,5.0
21375,LARGE CAMPHOR WOOD FIELD MUSHROOM ,11.02,213,2011-01-06,2011-09-08,3.0
21595,Dad's Cab Electronic Meter,8.47,118,2010-12-05,2010-12-07,4.0
22101,MIRROR MOSAIC VOTIVE HOLDER,2.51,209,2011-01-10,2011-09-09,4.25
35914,PINK CHICK EGG WARMER + EGG CUP,4.21,152,2011-01-19,2011-04-08,1.0
37462E,"PET MUG, GOLDFISH",0.84,72,2011-01-30,2011-07-31,1.75
37474,SET/4 2 TONE EGG SHAPE MIXING BOWLS,9.95,234,2010-12-05,2010-12-06,1.5
47481,50CM METAL STRING WITH  7 CLIPS,2.13,52,2011-01-16,2011-09-20,2.5
84313B,BLUE TV TRAY TABLE ,16.98,69,2011-01-09,2011-04-01,2.25
84422,PINK/BLUE DISC/MIRROR STRING,1.66,143,2010-12-16,2011-09-22,5.0
84429A,MEDIUM PINK BUDDHA HEAD ,5.91,246,2011-01-09,2011-08-22,3.0
84510C,SET OF 4 POLKADOT COASTERS,2.51,241,2011-01-10,2011-09-23,1.25
84917,WHITE HAND TOWEL WITH BUTTERFLY,4.21,235,2011-01-10,2011-05-04,3.25
85087,CANDY SPOT CUSHION COVER,8.47,213,2011-01-09,2011-09-09,4.5
85094,CANDY SPOT EGG WARMER RABBIT,2.51,153,2011-01-09,2011-09-14,2.25
85125,SMALL ROUND CUT GLASS CANDLESTICK,10.17,205,2011-01-09,2011-09-25,1.5
90013A,MIDNIGHT BLUE VINTAGE EARRINGS,3.81,131,2011-01-09,2011-09-07,2.0
90059A,DIAMANTE HAIR GRIP PACK/2 CRYSTAL,1.69,97,2011-01-09,2011-09-23,2.0
90073,VINTAGE ENAMEL & CRYSTAL EARRINGS,5.09,170,2011-01-11,2011-09-09,4.5
90074,BLACK DIAMOND CLUSTER NECKLACE,9.77,190,2011-11-27,2011-09-29,2.25
90104,PURPLE FRANGIPANI HAIRCLIP,0.83,233,2011-01-11,2011-04-06,1.5
90129C,GREEN GLASS TASSLE BAG CHARM,1.66,240,2011-10-18,2011-09-07,3.75
90129D,AMBER GLASS TASSLE BAG CHARM,1.66,169,2011-10-18,2011-09-07,4.75
90129E,PURPLE GLASS TASSLE BAG CHARM,1.66,176,2011-10-24,2011-09-07,3.0
90160C,TURQ+RED BOUDICCA LARGE BRACELET,7.22,189,2011-01-09,2011-09-07,4.5
90161D,ANT COPPER PINK BOUDICCA BRACELET,5.09,186,2011-01-11,2011-09-07,3.5
90175B,PINK GLASS CHUNKY CHARM BRACELET,9.34,56,2011-01-16,2011-09-07,1.75
90177D,DROP DIAMANTE EARRINGS PURPLE,2.96,153,2011-01-10,2011-09-23,4.75
90184C,BLACK CHUNKY BEAD BRACELET W STRAP,9.34,169,2011-01-10,2011-09-09,1.5
90185A,AMBER DIAMANTE EXPANDABLE RING,4.24,111,2011-01-23,2011-09-23,1.25
90208,PAIR OF PINK FLOWER CLUSTER SLIDE,2.54,55,2011-01-09,2011-09-23,1.5
15044D,RED PAPER PARASOL,5.91,190,2011-01-16,2011-09-09,3.0
84707A,SILVER JEWELLED MIRROR TRINKET TRAY,9.95,158,2011-01-09,2011-09-28,4.75
21617,4 LILY  BOTANICAL DINNER CANDLES,3.75,245,2011-01-09,2011-09-09,3.5
22693,GROW A FLYTRAP OR SUNFLOWER IN TIN,1.25,226,2011-01-10,2011-09-09,2.0
35646,VINTAGE BEAD PINK EVENING BAG,4.25,98,2011-01-09,2011-09-08,4.25
47574A,ENGLISH ROSE SCENTED HANGING FLOWER,4.25,124,2011-01-08,2011-09-09,3.5
72819,CUPID DESIGN SCENTED CANDLES,2.55,223,2011-01-11,2011-09-09,2.75
84665,SQUARE CHERRY BLOSSOM CABINET,5.95,81,2011-11-17,2011-09-23,4.0
20857,BLUE ROSE PATCH PURSE PINK BUTTERFL,1.65,104,2011-01-24,2011-02-07,3.5
85047,WHITE BEADED GARLAND STRING 20LIGHT,6.35,242,2011-01-24,2010-12-08,3.25
22679,FRENCH BLUE METAL DOOR SIGN 4,0.0,217,2011-01-09,2011-09-06,2.25
22520,CHILDS GARDEN TROWEL BLUE ,0.0,70,2011-01-09,2011-05-08,3.0
22516,CHILDS GARDEN RAKE BLUE,0.0,192,2011-01-12,2011-08-15,4.0
22353,LUNCH BOX WITH CUTLERY FAIRY CAKES ,0.0,174,2010-12-06,2011-05-08,4.75
22498,WOODEN REGATTA BUNTING,5.95,197,2011-01-10,2011-09-08,3.5
S,SAMPLES,12.95,164,2011-10-09,2011-08-25,2.25
84725,FREESTYLE CANVAS ART PICTURE,4.25,169,2010-12-06,2011-09-09,3.25
37479P,CUBIC MUG FLOCK PINK ON BROWN,2.55,230,2011-01-26,2011-09-28,5.0
AMAZONFEE,AMAZON FEE,1.0,69,2011-01-04,2011-09-15,1.25
17038,PORCELAIN BUDAH INCENSE HOLDER,0.07,125,2011-01-09,2011-09-09,3.25
84388,WISE MAN STAR SHAPE EGG PAN,1.65,51,2010-12-15,2011-04-19,1.75
17084J,LOVE POTION MASALA INCENSE,0.21,213,2011-01-30,2011-09-13,4.5
84968D,SET OF 16 VINTAGE RED CUTLERY,12.75,148,2011-01-09,2011-09-04,2.75
22211,WOOD STAMP SET FLOWERS,1.65,135,2011-01-09,2011-09-09,1.0
22903,CALENDAR FAMILY FAVOURITES,2.95,238,2011-01-11,2011-09-07,2.25
22026,BANQUET BIRTHDAY  CARD  ,0.42,52,2011-01-10,2011-09-08,3.75
37340,MULTICOLOUR SPRING FLOWER MUG,0.85,68,2011-01-12,2011-09-07,2.75
16052,TEATIME PUSH DOWN RUBBER,0.84,97,2011-01-11,2011-06-09,5.0
16219,HOUSE SHAPE PENCIL SHARPENER,1.7,152,2011-01-19,2011-09-08,4.0
20763,DAISY SKETCHBOOK ,7.62,231,2011-01-20,2011-09-04,2.0
20801,LARGE PINK GLASS SUNDAE DISH,5.06,177,2011-01-09,2011-05-09,1.25
20892,SET/3 TALL GLASS CANDLE HOLDER PINK,25.49,128,2010-12-20,2010-12-08,4.5
21316,SMALL CHUNKY GLASS ROMAN  BOWL,5.91,218,2011-01-11,2011-04-07,1.0
21666,RIDGED GLASS T-LIGHT HOLDER,1.66,228,2011-01-06,2011-09-08,4.0
22293,HANGING CHICK GREEN DECORATION,2.98,80,2011-01-10,2011-09-27,2.0
22608,PENS ASSORTED FUNKY JEWELED ,1.66,222,2011-01-09,2011-09-08,3.75
22789,T-LIGHT HOLDER SWEETHEART HANGING,4.21,194,2011-01-09,2011-09-07,4.0
22880,NUMBER TILE VINTAGE FONT 1,4.21,91,2011-01-10,2011-09-30,4.25
22883,NUMBER TILE VINTAGE FONT 4,4.21,56,2011-01-10,2011-09-29,4.0
22889,NUMBER TILE VINTAGE FONT No ,4.21,129,2011-01-10,2011-09-06,1.25
35809A,ENAMEL PINK TEA CONTAINER,4.21,248,2011-01-09,2011-06-09,5.0
35833P,4 PINK FLOCK CHRISTMAS BALLS,3.36,135,2011-01-11,2011-09-11,1.75
37500,TEA TIME TEAPOT IN GIFT BOX,21.23,94,2011-01-09,2011-09-09,3.0
37501,TEA TIME TEA SET IN GIFT BOX,14.43,160,2011-01-16,2011-08-24,2.5
79144C,PAINTED LIGHTBULB RAINBOW DESIGN,0.84,242,2011-01-09,2011-09-07,3.5
85130B,BEADED CRYSTAL HEART GREEN LARGE,3.36,208,2011-01-23,2011-09-07,1.75
85170C,SET/6 EAU DE NIL BIRD T-LIGHTS,4.21,216,2011-01-09,2011-09-29,2.0
90000B,MIDNIGHT BLUE COPPER FLOWER NECKLAC,6.37,189,2011-01-23,2011-07-25,3.5
90003B,ROSE COLOUR PAIR HEART HAIR SLIDES,3.81,138,2011-01-09,2011-09-23,3.25
90005A,JADE GREEN ENAMEL HAIR COMB,2.11,139,2010-12-09,2011-04-27,4.5
90019C,SILVER BLACK ORBIT BRACELET,5.51,178,2011-10-25,2011-09-06,1.0
