StockCode,Description,UnitPrice,QuantityAvailable,Product_Created,Product_lastUpdated,Ratings
22574,HEART WOODEN CHRISTMAS DECORATION,0.85,214,2011-01-16,2011-09-08,4.25
85199L,LARGE HANGING IVORY & RED WOOD BIRD,0.65,249,2011-01-12,2011-09-07,4.75
85199S,SMALL HANGING IVORY/RED WOOD BIRD,0.42,54,2011-01-09,2011-09-09,4.0
72741,GRAND CHOCOLATECANDLE,1.45,225,2011-01-09,2011-09-06,1.0
37495,FAIRY CAKE BIRTHDAY CANDLE SET,3.75,66,2011-01-10,2011-09-04,2.75
22171,3 HOOK PHOTO SHELF ANTIQUE WHITE,8.5,113,2011-01-09,2011-09-08,3.0
85067,CREAM SWEETHEART WALL CABINET,18.95,195,2011-01-12,2010-12-08,4.75
48184,DOORMAT ENGLISH ROSE ,7.95,141,2011-01-09,2011-09-09,4.5
48138,DOORMAT UNION FLAG,7.95,245,2011-01-10,2011-09-09,4.5
85019A,ROMANTIC IMAGES NOTEBOOK SET,4.25,176,2011-01-12,2011-09-29,2.75
85019C,CURIOUS  IMAGES NOTEBOOK SET,4.25,192,2011-01-10,2011-06-09,4.25
20902,VINTAGE KEEPSAKE BOX PARIS DAYS,6.35,154,2011-01-06,2011-08-09,4.5
21429,RED GINGHAM ROSE JEWELLERY BOX,1.65,192,2011-01-09,2011-09-09,2.0
85071A,BLUE CHARLIE+LOLA PERSONAL DOORSIGN,2.95,84,2011-01-09,2011-09-09,2.0
85071C,"CHARLIE+LOLA""EXTREMELY BUSY"" SIGN",2.55,179,2011-01-09,2011-09-09,3.75
22355,CHARLOTTE BAG SUKI DESIGN,0.85,208,2011-01-09,2011-09-09,4.75
21579,LOLITA  DESIGN  COTTON TOTE BAG,2.25,75,2011-01-10,2011-09-08,3.0
21576,LETS GO SHOPPING COTTON TOTE BAG,2.25,114,2011-01-17,2011-09-26,3.5
22493,PAINT YOUR OWN CANVAS SET,1.65,144,2011-01-10,2011-09-09,2.75
21833,CAMOUFLAGE LED TORCH,1.69,179,2011-01-09,2011-09-08,4.25
85135B,BLUE DRAGONFLY HELICOPTER,7.95,179,2011-10-27,2011-09-28,4.25
85136A,YELLOW SHARK HELICOPTER,7.95,140,2011-01-12,2011-09-04,2.0
85136C,RED SHARK HELICOPTER,7.95,66,2011-10-19,2011-08-28,1.0
21055,TOOL BOX SOFT TOY ,8.95,144,2011-01-12,2011-09-26,2.25
21056,DOCTOR'S BAG SOFT TOY,8.95,115,2011-01-12,2011-09-21,2.0
C2,CARRIAGE,50.0,154,2011-01-17,2011-09-07,4.25
21928,JUMBO BAG SCANDINAVIAN PAISLEY,1.95,81,2011-01-12,2011-09-09,3.25
20711,JUMBO BAG TOYS ,1.95,69,2011-01-10,2011-09-08,4.75
21773,DECORATIVE ROSE BATHROOM BOTTLE,2.51,174,2011-01-09,2011-09-07,1.0
21774,DECORATIVE CATS BATHROOM BOTTLE,2.51,211,2011-01-09,2011-09-06,1.75
21787,RAIN PONCHO RETROSPOT,1.66,147,2011-01-09,2011-09-08,2.5
21801,CHRISTMAS TREE DECORATION WITH BELL,0.43,234,2011-01-09,2011-09-07,4.0
21802,CHRISTMAS TREE HEART DECORATION,0.43,180,2011-01-09,2011-09-07,2.75
21803,CHRISTMAS TREE STAR DECORATION,0.43,135,2011-01-09,2011-09-07,4.25
21809,CHRISTMAS HANGING TREE WITH BELL,2.51,157,2011-01-11,2011-09-30,4.0
21821,GLITTER STAR GARLAND WITH BELLS ,7.62,144,2011-01-13,2011-09-07,1.25
21822,GLITTER CHRISTMAS TREE WITH BELLS,4.21,178,2011-10-09,2011-09-30,3.5
21851,LILAC DIAMANTE PEN IN GIFT BOX,4.21,211,2011-01-16,2011-09-05,3.25
21879,HEARTS GIFT TAPE,1.66,191,2011-01-09,2011-09-08,4.5
21884,CAKES AND BOWS GIFT  TAPE,1.66,116,2011-01-09,2011-09-08,4.0
21888,BINGO SET,7.62,145,2011-01-09,2011-09-09,3.5
21911,GARDEN METAL SIGN ,3.36,165,2011-01-09,2011-04-15,3.75
21922,UNION STRIPE WITH FRINGE  HAMMOCK,16.98,206,2011-01-29,2011-09-08,1.0
21935,SUKI  SHOULDER BAG,3.36,121,2011-01-09,2011-09-09,1.25
21942,SKULLS DESIGN FLANNEL,1.66,170,2011-01-13,2011-09-26,3.0
21944,KITTENS DESIGN FLANNEL,1.66,102,2011-01-09,2011-09-07,4.25
21949,SET OF 6 STRAWBERRY CHOPSTICKS,2.51,131,2011-01-09,2011-09-30,4.5
21990,MODERN FLORAL STATIONERY SET,2.51,71,2011-01-09,2011-09-08,4.5
21991,BOHEMIAN COLLAGE STATIONERY SET,2.51,67,2011-01-09,2011-09-07,3.75
21993,FLORAL FOLK STATIONERY SET,2.51,242,2011-01-09,2011-09-08,2.25
22037,ROBOT BIRTHDAY CARD,0.85,194,2011-01-09,2011-09-08,4.0
22043,CHRISTMAS CARD SCREEN PRINT ,0.43,130,2011-01-16,2011-09-30,3.75
22065,CHRISTMAS PUDDING TRINKET POT ,3.36,157,2011-01-13,2011-09-07,2.25
22067,CHOC TRUFFLE GOLD TRINKET POT ,3.36,183,2011-01-13,2011-09-28,2.25
22069,BROWN  PIRATE TREASURE CHEST ,3.36,196,2011-01-09,2011-09-30,4.5
22071,SMALL WHITE RETROSPOT MUG IN BOX ,7.62,184,2011-01-11,2011-09-06,2.25
22076,6 RIBBONS EMPIRE  ,3.36,55,2011-01-10,2011-09-09,1.25
22080,RIBBON REEL POLKADOTS ,3.36,126,2011-01-09,2011-09-09,4.0
22081,RIBBON REEL FLORA + FAUNA ,3.36,189,2011-01-11,2011-09-27,3.25
22090,PAPER BUNTING RETROSPOT,5.91,236,2011-01-09,2011-09-08,5.0
22134,LADLE LOVE HEART RED ,0.85,154,2011-01-09,2011-09-07,4.0
22135,LADLE LOVE HEART PINK,0.85,132,2011-01-09,2011-09-06,1.75
22154,ANGEL DECORATION 3 BUTTONS ,0.85,117,2011-01-09,2011-09-08,2.0
22155,STAR DECORATION RUSTIC,0.85,161,2011-01-03,2011-09-08,1.25
22156,HEART DECORATION WITH PEARLS ,1.66,148,2011-01-09,2011-09-07,5.0
22161,HEART DECORATION RUSTIC HANGING ,0.81,229,2011-01-09,2011-09-07,2.75
22162,HEART GARLAND RUSTIC PADDED,3.36,246,2011-01-09,2011-08-11,2.75
22169,FAMILY ALBUM WHITE PICTURE FRAME,16.98,116,2011-01-09,2011-09-09,3.0
22182,CAKE STAND VICTORIAN FILIGREE SMALL,4.21,132,2011-01-09,2011-09-28,4.75
22190,LOCAL CAFE MUG,2.51,102,2011-01-10,2011-09-08,3.25
22203,MILK PAN RED RETROSPOT,7.62,129,2011-01-09,2011-09-08,4.0
22207,FRYING PAN UNION FLAG,8.47,210,2011-01-11,2011-09-07,1.5
22265,EASTER DECORATION NATURAL CHICK,1.28,239,2011-01-09,2011-09-11,4.5
22276,WASH BAG VINTAGE ROSE PAISLEY,5.91,108,2011-01-13,2011-09-09,3.25
22299,PIG KEYRING WITH LIGHT & SOUND ,2.51,53,2011-01-11,2011-09-07,1.25
22300,COFFEE MUG DOG + BALL DESIGN,5.06,154,2011-01-11,2011-09-08,4.75
22301,COFFEE MUG CAT + BIRD DESIGN,5.06,58,2011-01-09,2011-09-08,5.0
22309,TEA COSY RED  STRIPE,5.06,129,2011-01-10,2011-09-09,2.75
22314,OFFICE MUG WARMER CHOC+BLUE,5.91,64,2011-01-11,2011-09-09,5.0
22335,HEART DECORATION PAINTED ZINC ,1.28,216,2011-01-09,2011-09-09,2.25
22336,DOVE DECORATION PAINTED ZINC ,1.28,82,2011-01-09,2011-09-07,4.0
22345,PARTY PIZZA DISH BLUE POLKADOT,1.66,155,2011-01-09,2011-09-14,2.5
22348,TEA BAG PLATE RED RETROSPOT,1.66,176,2011-01-09,2011-09-09,1.0
22356,CHARLOTTE BAG PINK POLKADOT,1.66,226,2011-01-09,2011-09-09,1.5
22359,GLASS JAR KINGS CHOICE,5.91,210,2011-01-10,2011-09-08,2.0
22361,GLASS JAR DAISY FRESH COTTON WOOL,5.91,95,2011-01-09,2011-09-09,2.25
22375,AIRLINE BAG VINTAGE JET SET BROWN,8.47,172,2011-01-09,2011-09-09,4.5
22378,WALL TIDY RETROSPOT ,4.21,127,2011-01-09,2011-09-07,4.75
22380,TOY TIDY SPACEBOY  ,4.21,205,2011-01-10,2011-09-09,1.75
22394,PAPERWEIGHT KINGS CHOICE ,5.06,227,2011-01-11,2011-09-12,1.5
22396,MAGNETS PACK OF 4 RETRO PHOTO,2.51,223,2011-01-09,2011-09-09,1.0
22419,LIPSTICK PEN RED,0.85,250,2011-01-10,2011-09-08,2.75
22422,TOOTHPASTE TUBE PEN,1.28,81,2011-01-09,2011-09-09,1.5
22430,ENAMEL WATERING CAN CREAM,10.17,241,2011-01-09,2011-09-07,4.25
22432,WATERING CAN PINK BUNNY,4.21,199,2011-01-09,2011-09-08,2.5
22437,SET OF 9 BLACK SKULL BALLOONS,1.66,54,2011-01-09,2011-09-08,4.75
22471,TV DINNER TRAY AIR HOSTESS ,11.02,70,2011-01-09,2011-09-07,2.75
22476,EMPIRE UNION JACK TV DINNER TRAY,11.02,180,2011-01-09,2011-09-07,4.25
22477,WATERING CAN GARDEN MARKER,2.51,60,2011-01-17,2011-09-08,3.25
22478,BIRDHOUSE GARDEN MARKER ,2.51,227,2011-01-10,2011-09-08,1.0
22479,DAISY GARDEN MARKER,2.51,98,2011-01-19,2011-09-07,2.5
22497,SET OF 2 TINS VINTAGE BATHROOM ,8.47,149,2011-01-13,2011-09-04,1.25
22515,CHILDS GARDEN SPADE PINK,4.21,82,2011-01-12,2011-09-28,2.5
22517,CHILDS GARDEN RAKE PINK,4.21,218,2011-01-12,2011-09-23,2.0
22519,CHILDS GARDEN BRUSH PINK,4.21,191,2011-01-12,2011-06-07,1.0
22545,MINI JIGSAW BUNNIES,0.85,75,2011-01-12,2011-09-29,3.5
22550,HOLIDAY FUN LUDO,7.62,182,2011-01-11,2011-09-09,4.0
22560,TRADITIONAL MODELLING CLAY,2.51,68,2011-01-09,2011-09-09,3.5
22589,CARDHOLDER GINGHAM STAR,5.06,133,2011-01-03,2011-09-30,2.5
22605,WOODEN CROQUET GARDEN SET,25.49,136,2011-01-11,2011-09-08,5.0
22639,SET OF 4 NAPKIN CHARMS HEARTS,5.06,86,2011-01-10,2011-09-06,2.25
22669,RED BABY BUNTING ,5.91,205,2011-01-09,2011-09-09,4.75
22675,FRENCH KITCHEN SIGN BLUE METAL,2.51,222,2011-01-09,2011-09-07,2.25
22734,SET OF 6 RIBBONS VINTAGE CHRISTMAS,5.06,189,2011-01-10,2011-09-08,1.5
22741,FUNKY DIVA PEN,1.66,200,2011-01-12,2011-09-09,4.25
22755,SMALL PURPLE BABUSHKA NOTEBOOK ,1.66,197,2011-01-12,2011-09-07,3.0
22757,LARGE RED BABUSHKA NOTEBOOK ,2.51,122,2011-01-11,2011-09-09,3.5
22758,LARGE PURPLE BABUSHKA NOTEBOOK  ,2.51,130,2011-01-12,2011-09-06,3.5
22769,CHALKBOARD KITCHEN ORGANISER,51.02,87,2011-01-03,2010-12-09,1.25
22792,FLUTED ANTIQUE CANDLE HOLDER,1.66,114,2011-01-10,2011-09-07,1.25
22816,CARD MOTORBIKE SANTA,0.85,117,2011-01-09,2011-09-09,2.25
22818,CARD CHRISTMAS VILLAGE,0.85,71,2011-01-16,2011-09-09,1.75
22822,CREAM WALL PLANTER HEART SHAPED,12.72,136,2011-01-10,2011-09-27,2.0
22844,VINTAGE CREAM DOG FOOD CONTAINER,16.98,86,2011-01-09,2011-09-09,3.75
22847,BREAD BIN DINER STYLE IVORY,34.0,152,2011-01-09,2011-09-09,4.25
22862,LOVE HEART NAPKIN BOX ,8.47,236,2011-01-09,2010-12-09,1.5
22876,NUMBER TILE COTTAGE GARDEN 8,4.21,221,2011-01-10,2011-09-27,2.25
22928,YELLOW GIANT GARDEN THERMOMETER,11.87,80,2011-01-12,2011-09-08,2.5
22948,METAL DECORATION NAUGHTY CHILDREN ,6.77,56,2011-01-09,2011-09-09,1.0
22949,36 DOILIES DOLLY GIRL,2.98,189,2011-01-10,2011-09-08,4.75
22976,CIRCUS PARADE CHILDRENS EGG CUP ,2.51,218,2011-01-09,2011-09-05,3.5
35095A,BLUE VICTORIAN FABRIC OVAL BOX,0.84,96,2011-01-11,2011-09-07,2.5
35095B,RED VICTORIAN FABRIC OVAL BOX,0.84,66,2011-01-15,2011-09-08,3.75
35471D,SET OF 3 BIRD LIGHT PINK FEATHER ,2.51,108,2011-01-09,2011-09-07,2.25
35598D,PINK/WHITE CHRISTMAS TREE 60CM,2.51,84,2011-01-16,2011-09-30,2.5
35599D,PINK AND WHITE CHRISTMAS TREE 120CM,5.91,186,2011-10-09,2011-09-07,3.0
35610A,PINK CHRISTMAS FLOCK DROPLET ,2.51,156,2010-11-30,2011-03-09,1.75
35818P,"ACRYLIC JEWEL ICICLE, PINK",3.36,247,2011-10-10,2011-09-16,2.0
35957,SMALLFOLKART BAUBLE CHRISTMAS DEC,1.66,192,2011-01-09,2010-12-09,1.0
35961,FOLKART ZINC HEART CHRISTMAS DEC,1.66,250,2011-01-09,2011-09-08,4.25
35971,ROSE FOLKART HEART DECORATIONS,2.51,208,2011-01-12,2011-09-09,3.75
37449,CERAMIC CAKE STAND + HANGING CAKES,21.23,214,2011-01-09,2011-09-06,3.5
37476,CONDIMENT TRAY 4 BOWLS AND 4 SPOONS,18.68,249,2011-01-13,2011-09-25,1.5
47559B,TEA TIME OVEN GLOVE,2.51,242,2011-01-09,2011-09-08,3.75
47591B,SCOTTIES CHILDRENS APRON,1.66,214,2011-01-09,2011-02-02,1.5
47591D,PINK FAIRY CAKE CHILDRENS APRON,4.21,87,2011-01-03,2011-09-08,1.0
47593B,SCOTTIE DOGS BABY BIB,0.85,209,2011-01-09,2011-09-07,3.0
48188,DOORMAT WELCOME PUPPIES,14.43,64,2011-01-09,2011-09-07,4.5
71459,HANGING JAM JAR T-LIGHT HOLDER,1.69,184,2011-01-09,2011-09-08,3.75
72586,SET OF 6 HALLOWEEN GHOST T-LIGHTS,0.85,77,2011-01-13,2011-09-09,2.25
72799E,IVORY PILLAR CANDLE SILVER FLOCK,3.36,167,2011-01-09,2011-09-04,2.75
72799F,IVORY PILLAR CANDLE GOLD FLOCK,3.36,201,2011-01-11,2011-09-28,3.75
72807A,SET/3 ROSE CANDLE IN JEWELLED BOX,8.47,53,2011-01-11,2011-09-07,3.25
72807B,SET/3 OCEAN SCENT CANDLE JEWEL BOX,8.47,190,2011-01-11,2011-09-04,2.0
72807C,SET/3 VANILLA SCENTED CANDLE IN BOX,8.47,228,2011-01-11,2011-09-08,2.5
72816,SET/3 CHRISTMAS DECOUPAGE CANDLES,2.51,208,2011-01-09,2011-09-08,4.75
79030D,"TUMBLER, BAROQUE",12.72,225,2011-01-27,2011-09-18,3.75
79030G,"TUMBLER, NEW ENGLAND",12.72,144,2011-01-09,2011-06-03,1.5
82551,LAUNDRY 15C METAL SIGN,2.51,164,2011-01-09,2011-09-09,4.0
82583,HOT BATHS METAL SIGN,4.21,132,2011-01-09,2011-09-09,1.25
82613B,"METAL SIGN,CUPCAKE SINGLE HOOK",2.51,101,2011-01-09,2011-09-09,1.5
82613C,"METAL SIGN,CUPCAKE SINGLE HOOK",2.51,224,2011-01-09,2011-09-09,2.25
82613D,METAL SIGN CUPCAKE SINGLE HOOK,2.51,59,2011-01-09,2011-09-09,1.75
84031A,CHARLIE+LOLA RED HOT WATER BOTTLE ,4.21,233,2011-01-09,2011-09-09,2.5
84031B,CHARLIE LOLA BLUE HOT WATER BOTTLE ,4.21,234,2011-01-09,2011-09-09,5.0
84032A,CHARLIE+LOLA PINK HOT WATER BOTTLE,3.36,123,2011-01-09,2011-09-09,4.0
84086C,PINK/PURPLE RETRO RADIO,4.21,92,2011-01-09,2011-09-09,1.5
84279P,CHERRY BLOSSOM  DECORATIVE FLASK,8.47,107,2011-01-11,2011-09-08,2.0
85015,SET OF 12  VINTAGE POSTCARD SET,2.51,152,2011-01-11,2011-09-07,4.25
85016,SET OF 6 VINTAGE NOTELETS KIT,2.51,193,2011-01-09,2011-05-09,4.75
85017A,ENVELOPE 50 ROMANTIC IMAGES,0.85,186,2010-11-30,2011-04-03,2.25
85017B,ENVELOPE 50 BLOSSOM IMAGES,0.85,165,2011-01-09,2011-09-09,4.0
85032D,YULETIDE IMAGES GIFT WRAP SET,1.66,94,2011-01-09,2011-09-09,4.0
85039A,SET/4 RED MINI ROSE CANDLE IN BOWL,1.66,244,2011-01-09,2011-09-09,4.0
85048,15CM CHRISTMAS GLASS BALL 20 LIGHTS,16.98,179,2011-01-10,2011-09-09,2.75
85064,CREAM SWEETHEART LETTER RACK,11.02,152,2011-01-11,2011-04-11,3.75
85127,SMALL SQUARE CUT GLASS CANDLESTICK,10.17,185,2011-01-09,2011-09-05,4.5
85129D,BEADED CRYSTAL HEART PINK SMALL,2.51,148,2011-01-09,2011-09-26,4.25
85131B,BEADED CRYSTAL HEART GREEN ON STICK,0.85,231,2011-01-09,2011-09-09,1.0
85132A,CHARLIE + LOLA BISCUITS TINS,8.47,170,2011-01-09,2011-05-09,4.25
85135C,RED DRAGONFLY HELICOPTER,8.47,201,2011-01-12,2011-09-08,2.0
85176,SEWING SUSAN 21 NEEDLE SET,1.66,244,2011-01-10,2011-09-29,3.25
85177,BASKET OF FLOWERS SEWING KIT,1.66,189,2011-01-10,2011-09-29,3.25
85178,VICTORIAN SEWING KIT,2.51,105,2011-01-09,2011-09-07,2.25
85186A,EASTER BUNNY GARLAND OF FLOWERS,0.85,88,2011-01-11,2011-04-07,4.0
85232B,SET OF 3 BABUSHKA STACKING TINS,4.95,144,2011-01-09,2011-02-08,3.5
90003C,MIDNIGHT BLUE PAIR HEART HAIR SLIDE,3.81,197,2011-01-09,2011-09-05,5.0
90018A,SILVER M.O.P ORBIT DROP EARRINGS,4.24,217,2011-01-09,2011-09-23,1.0
90022,EDWARDIAN DROP EARRINGS JET BLACK,3.81,100,2011-10-11,2011-09-23,1.25
90071,RUBY GLASS CLUSTER EARRINGS,1.26,235,2011-01-11,2011-09-07,3.75
90099,NECKLACE+BRACELET SET BLUE HIBISCUS,5.06,122,2011-10-03,2011-05-17,4.75
90116,FRUIT SALAD BAG CHARM,2.51,208,2011-01-09,2011-09-30,2.75
90120C,GREEN MURANO TWIST BRACELET,4.24,70,2011-01-09,2011-09-06,4.75
90129A,PINK GLASS TASSLE BAG CHARM ,1.66,63,2011-01-10,2011-09-07,3.0
90129B,TURQUOISE GLASS TASSLE BAG CHARM ,1.66,187,2011-01-10,2011-09-07,2.5
90161A,ANT COPPER RED BOUDICCA BRACELET,5.09,249,2011-01-11,2011-09-07,2.25
90190C,SILVER/AMETHYST DROP EARRINGS LEAF,2.96,143,2011-01-27,2011-09-23,2.0
90194,SILVER LARIAT BLACK STONE EARRINGS,4.24,218,2011-01-17,2011-09-06,4.5
90209B,GREEN ENAMEL+GLASS HAIR COMB,2.11,171,2011-01-09,2011-08-08,1.0
90214D,"LETTER ""D"" BLING KEY RING",0.85,93,2011-01-09,2011-09-28,4.25
90214G,"LETTER ""G"" BLING KEY RING",0.85,65,2011-01-16,2011-09-02,2.0
90214H,"LETTER ""H"" BLING KEY RING",0.85,142,2011-01-17,2011-09-28,2.25
90214J,"LETTER ""J"" BLING KEY RING",0.85,224,2011-01-17,2011-09-05,1.0
90214R,"LETTER ""R"" BLING KEY RING",0.85,177,2011-01-17,2011-09-05,4.25
DOT,DOTCOM POSTAGE,569.77,115,2011-01-09,2011-09-09,3.0
84534B,FAIRY CAKE NOTEBOOK A5 SIZE,1.66,61,2011-01-19,2010-12-09,5.0
84535B,FAIRY CAKES NOTEBOOK A6 SIZE,1.49,199,2011-01-11,2011-09-09,1.0
84536A,ENGLISH ROSE NOTEBOOK A7 SIZE,0.85,213,2011-01-09,2011-09-09,5.0
84536B,FAIRY CAKES NOTEBOOK A7 SIZE,0.85,64,2011-01-09,2011-09-09,3.25
84580,MOUSE TOY WITH PINK T-SHIRT,4.21,94,2011-01-09,2011-09-09,5.0
84581,DOG TOY WITH PINK CROCHET SKIRT,4.21,123,2011-01-09,2011-09-09,5.0
84598,BOYS ALPHABET IRON ON PATCHES,0.43,62,2011-01-10,2011-09-09,1.75
84912B,GREEN ROSE WASHBAG,3.36,74,2011-01-09,2011-09-07,2.0
84913A,SOFT PINK ROSE TOWEL ,3.36,90,2011-01-09,2011-08-08,3.75
84913B,MINT GREEN ROSE TOWEL,3.36,186,2011-01-09,2011-09-28,3.25
84923,PINK BUTTERFLY HANDBAG W BOBBLES,4.21,183,2011-01-09,2011-09-09,1.0
84946,ANTIQUE SILVER TEA GLASS ETCHED,2.51,176,2011-01-09,2011-09-09,3.0
84988,SET OF 72 PINK HEART PAPER DOILIES,2.98,199,2011-01-09,2011-09-09,3.25
20856,DENIM PATCH PURSE PINK BUTTERFLY,1.65,103,2011-01-09,2011-09-12,5.0
20854,BLUE PATCH PURSE PINK HEART,1.65,223,2011-01-09,2011-02-20,1.5
21218,RED SPOTTY BISCUIT TIN,3.75,200,2011-01-10,2011-09-09,3.0
22845,VINTAGE CREAM CAT FOOD CONTAINER,6.35,214,2011-01-09,2011-09-07,1.5
11001,ASSTD DESIGN RACING CAR PEN,3.36,55,2011-01-09,2011-09-04,1.75
16236,KITTY PENCIL ERASERS,0.43,228,2011-01-09,2011-09-28,1.75
17003,BROCADE RING PURSE ,0.43,220,2011-01-09,2011-09-08,3.0
17011F,ORIGAMI SANDLEWOOD INCENSE+FLOWER,4.21,180,2011-01-16,2011-05-19,1.75
17012A,ORIGAMI VANILLA INCENSE/CANDLE SET ,2.51,215,2011-01-11,2011-09-09,1.75
17012B,ORIGAMI JASMINE INCENSE/CANDLE SET,2.51,171,2011-01-09,2011-09-08,4.0
17012C,ORIGAMI LAVENDER INCENSE/CANDL SET ,2.51,150,2011-01-09,2011-09-21,4.5
17012D,ORIGAMI ROSE INCENSE/CANDLE SET ,2.51,211,2011-01-09,2011-09-08,3.5
17012E,ORIGAMI OPIUM INCENSE/CANDLE SET ,2.51,78,2010-11-30,2010-12-09,4.5
17012F,ORIGAMI SANDLEWOOD INCENSE/CAND SET,2.51,242,2011-01-10,2011-09-09,3.0
17129F,BLUE GLASS GEMS IN BAG,1.66,117,2011-01-16,2011-09-07,5.0
18098C,PORCELAIN BUTTERFLY OIL BURNER,5.91,250,2011-01-09,2011-08-08,1.75
20622,VIPPASSPORT COVER ,4.21,90,2011-01-09,2011-09-08,4.25
20658,RED RETROSPOT LUGGAGE TAG,2.51,148,2011-01-11,2011-09-26,2.75
20662,FIRST CLASS HOLIDAY PURSE ,2.51,206,2011-01-09,2011-07-05,2.25
20676,RED RETROSPOT BOWL,2.51,249,2011-01-10,2011-09-08,1.0
20684,STRAWBERRY DREAM CHILDS UMBRELLA,6.77,215,2011-01-10,2011-07-06,3.5
20719,WOODLAND CHARLOTTE BAG,1.66,238,2011-01-09,2011-09-09,4.25
20724,RED RETROSPOT CHARLOTTE BAG,1.66,114,2011-01-09,2011-09-09,2.75
20733,GOLD MINI TAPE MEASURE ,0.85,127,2011-01-09,2011-09-09,4.0
20735,BLACK MINI TAPE MEASURE ,0.85,168,2011-01-10,2011-09-20,2.0
20770,ABSTRACT CIRCLE JOURNAL ,2.51,91,2011-01-09,2011-09-28,2.75
20835,FRENCH LATTICE CUSHION COVER ,11.02,143,2011-10-01,2011-06-07,3.75
20839,FRENCH PAISLEY CUSHION COVER ,9.32,172,2011-01-20,2011-09-09,1.0
20840,FRENCH FLORAL CUSHION COVER ,9.32,63,2011-10-12,2011-09-09,2.0
20956,PORCELAIN T-LIGHT HOLDERS ASSORTED,2.51,171,2011-01-09,2011-09-09,3.0
20969,RED FLORAL FELTCRAFT SHOULDER BAG,7.62,98,2011-01-10,2011-09-09,4.5
20971,PINK BLUE FELT CRAFT TRINKET BOX,2.51,66,2011-01-09,2011-09-09,2.5
20975,12 PENCILS SMALL TUBE RED RETROSPOT,1.28,62,2011-01-12,2011-09-30,5.0
20981,12 PENCILS TALL TUBE WOODLAND,1.66,162,2011-01-09,2011-09-09,1.75
20996,JAZZ HEARTS ADDRESS BOOK,0.84,52,2011-01-10,2011-09-29,1.5
21000,ROSE DU SUD COSMETICS BAG,3.36,155,2011-01-09,2011-09-05,5.0
21012,ANTIQUE ALL GLASS CANDLESTICK,2.51,169,2011-01-09,2011-09-09,1.25
21069,VINTAGE BILLBOARD TEA MUG,2.51,178,2011-01-13,2011-08-17,5.0
21070,VINTAGE BILLBOARD MUG ,2.51,133,2011-01-11,2011-09-07,4.0
21147,JINGLE BELLS TREE DECORATION,2.51,91,2011-01-10,2011-09-27,1.75
21158,MOODY GIRL DOOR HANGER ,3.36,231,2011-01-13,2011-09-08,1.25
21165,BEWARE OF THE CAT METAL SIGN ,4.21,138,2011-01-09,2011-09-09,4.0
21174,POTTERING IN THE SHED METAL SIGN,4.21,56,2011-01-09,2011-09-09,3.75
21189,WHITE HONEYCOMB PAPER GARLAND ,3.36,55,2011-01-06,2011-09-09,2.5
21191,LARGE WHITE HONEYCOMB PAPER BELL  ,4.21,118,2011-01-17,2011-09-29,4.0
21195,PINK  HONEYCOMB PAPER BALL ,4.21,228,2011-01-09,2011-05-09,3.75
21207,SKULL AND CROSSBONES  GARLAND ,3.36,167,2011-01-13,2011-09-08,3.0
21216,"SET 3 RETROSPOT TEA,COFFEE,SUGAR",11.02,91,2011-01-11,2011-09-09,4.0
21217,RED RETROSPOT ROUND CAKE TINS,21.23,175,2011-01-11,2011-09-09,4.75
21231,SWEETHEART CERAMIC TRINKET BOX,2.51,108,2011-01-10,2011-09-09,1.5
21238,RED RETROSPOT CUP,1.66,221,2011-01-09,2011-09-09,4.0
21249,WOODLAND  HEIGHT CHART STICKERS ,5.91,204,2011-01-09,2011-09-28,3.25
21262,WHITE GOOSE FEATHER CHRISTMAS TREE ,7.62,146,2011-01-23,2011-09-07,4.75
21313,GLASS HEART T-LIGHT HOLDER ,1.66,101,2011-01-09,2011-09-09,3.25
21349,IVY HEART WREATH,13.57,80,2011-10-19,2010-12-06,3.5
21352,EUCALYPTUS & PINECONE  WREATH,5.91,75,2011-01-09,2011-09-07,2.75
21354,TOAST ITS - BEST MUM,2.51,245,2011-01-11,2011-09-07,3.5
21365,MIRRORED WALL ART STARS,5.91,230,2011-01-13,2011-09-09,2.5
21366,MIRRORED WALL ART PHOTO FRAMES,8.47,150,2011-01-11,2011-09-28,4.25
21369,MIRRORED WALL ART SPLODGES,7.62,61,2011-01-09,2011-09-08,3.25
21372,MIRRORED WALL ART TABLE LAMP,5.91,56,2011-01-27,2011-09-23,4.25
21385,IVORY HANGING DECORATION  HEART,1.66,93,2011-01-09,2011-09-09,3.75
21407,BROWN CHECK CAT DOORSTOP ,8.47,99,2011-01-09,2011-09-08,4.25
21408,SPOTTY PINK DUCK DOORSTOP,8.47,116,2011-01-23,2011-09-07,3.5
21507,"ELEPHANT, BIRTHDAY CARD, ",0.85,203,2011-01-09,2011-09-09,2.75
21563,RED HEART SHAPE LOVE BUCKET ,5.91,72,2011-01-11,2011-09-07,5.0
21564,PINK  HEART SHAPE LOVE BUCKET ,5.91,226,2011-01-11,2011-09-09,1.75
21634,ASSORTED MINI MADRAS NOTEBOOK,2.51,188,2011-10-15,2011-09-29,2.5
21641,ASSORTED TUTTI FRUTTI KEYRING BALL,1.66,153,2011-01-06,2011-09-09,1.0
21679,SKULLS  STICKERS,1.66,68,2011-01-12,2011-09-07,3.5
21703,BAG 125g SWIRLY MARBLES,0.85,225,2011-01-10,2011-09-09,4.0
21704,BAG 250g SWIRLY MARBLES,1.66,62,2011-01-11,2011-09-08,4.75
21721,CANDY SHOP  STICKER SHEET,1.66,86,2011-01-16,2011-08-28,4.75
21722,SWEET PUDDING STICKER SHEET,1.66,170,2011-10-24,2011-09-02,4.0
21758,VINTAGE SHELLS PRINT,12.72,224,2011-01-23,2011-08-04,5.0
22892,SET OF SALT AND PEPPER TOADSTOOLS,1.25,186,2011-01-10,2011-09-09,2.0
22245,"HOOK, 1 HANGER ,MAGIC GARDEN",0.85,213,2011-01-09,2011-09-01,1.0
20957,PORCELAIN HANGING BELL SMALL,1.45,156,2010-11-30,2010-12-01,3.25
79144B,PAINTED LIGHTBULB STAR+ MOON,0.42,217,2011-01-10,2011-09-05,4.25
22482,BLUE TEA TOWEL CLASSIC DESIGN,1.25,140,2011-01-12,2011-07-05,2.0
21917,SET 12 KIDS  WHITE CHALK STICKS,0.42,181,2011-01-10,2011-09-09,4.25
20697,LITTLE GREEN MONSTER SOFT TOY,2.55,180,2011-01-22,2011-09-20,2.75
22599,CHRISTMAS MUSICAL ZINC STAR,0.85,94,2011-10-09,2011-09-28,2.75
22597,CHRISTMAS MUSICAL ZINC HEART ,0.85,124,2011-01-16,2011-09-08,4.75
21495,SKULLS AND CROSSBONES WRAP,0.42,222,2011-01-09,2011-09-09,1.0
46000R,POLYESTER FILLER PAD 45x30cm,1.45,213,2011-01-24,2011-09-26,3.5
46000S,POLYESTER FILLER PAD 40x40cm,1.45,91,2011-01-12,2011-09-09,2.25
84920,PINK FLOWER FABRIC PONY,3.75,71,2011-01-16,2011-09-09,2.0
22953,BIRTHDAY PARTY CORDON BARRIER TAPE,1.25,117,2011-01-11,2011-09-08,2.75
84508A,CAMOUFLAGE DESIGN TEDDY,2.55,175,2011-01-16,2011-09-05,2.0
21670,BLUE SPOT CERAMIC DRAWER KNOB,1.25,96,2011-01-10,2011-09-09,4.25
22786,CUSHION COVER PINK UNION JACK,5.95,207,2011-01-20,2011-09-30,2.75
22212,FOUR HOOK  WHITE LOVEBIRDS,2.1,63,2011-01-09,2011-09-08,5.0
22678,FRENCH BLUE METAL DOOR SIGN 3,1.25,237,2011-01-09,2011-09-07,2.75
22686,FRENCH BLUE METAL DOOR SIGN No,1.25,163,2011-01-09,2011-09-30,1.0
84685,BEACH HUT KEY CABINET,3.75,213,2011-01-12,2011-05-09,2.5
20616,CHERRY BLOSSOM PASSPORT COVER,2.1,73,2011-01-09,2011-09-19,3.5
22753,SMALL YELLOW BABUSHKA NOTEBOOK ,0.85,122,2011-01-09,2011-09-09,3.0
79066K,RETRO MOD TRAY,0.85,184,2011-01-09,2011-09-08,1.5
22794,SWEETHEART WIRE MAGAZINE RACK,7.95,72,2011-01-09,2011-09-07,2.25
22592,CARDHOLDER HOLLY WREATH METAL,3.75,210,2011-01-09,2011-09-05,3.5
84352,SILVER CHRISTMAS TREE BAUBLE STAND ,16.95,212,2011-01-11,2011-09-21,2.5
22795,SWEETHEART RECIPE BOOK STAND,6.75,104,2011-01-09,2011-09-09,4.25
22278,OVERNIGHT BAG VINTAGE ROSE PAISLEY,4.95,195,2011-01-13,2011-09-08,4.75
22802,FAUX FUR CHOCOLATE THROW,19.95,76,2011-01-16,2011-09-08,3.0
84884A,ANT WHITE WIRE HEART SPIRAL,3.95,146,2011-01-10,2011-09-08,4.0
51014C,"FEATHER PEN,COAL BLACK",0.85,243,2011-01-11,2011-09-09,2.25
51014L,"FEATHER PEN,LIGHT PINK",0.85,242,2011-01-09,2011-09-08,1.75
51014A,"FEATHER PEN,HOT PINK",0.85,184,2011-01-09,2011-09-09,2.5
22366,DOORMAT AIRMAIL ,6.75,158,2011-01-09,2011-09-05,3.75
48111,DOORMAT 3 SMILEY CATS,6.75,168,2011-01-09,2011-09-07,1.5
22846,BREAD BIN DINER STYLE RED ,14.95,67,2011-01-09,2011-09-08,2.0
22402,MAGNETS PACK OF 4 VINTAGE COLLAGE,1.25,148,2011-01-16,2011-09-09,5.0
22400,MAGNETS PACK OF 4 HOME SWEET HOME,1.25,232,2011-01-25,2011-09-09,5.0
22399,MAGNETS PACK OF 4 CHILDHOOD MEMORY,1.25,212,2011-01-11,2011-09-06,5.0
79302M,"ART LIGHTS,FUNK MONKEY",2.95,188,2011-01-10,2011-09-05,3.75
37446,MINI CAKE STAND WITH HANGING CAKES,1.45,164,2011-01-09,2011-09-09,3.0
84509B,SET OF 4 FAIRY CAKE PLACEMATS,3.75,197,2011-01-09,2011-09-08,2.75
22313,OFFICE MUG WARMER PINK,2.95,106,2011-01-12,2011-09-07,2.75
21181,PLEASE ONE PERSON METAL SIGN,2.1,52,2011-01-09,2011-09-09,1.5
21818,GLITTER CHRISTMAS HEART ,0.85,146,2011-01-16,2011-09-07,2.5
21668,RED STRIPE CERAMIC DRAWER KNOB,1.25,177,2011-01-10,2011-09-09,4.25
21462,"NURSERY A,B,C PAINTED LETTERS",6.75,52,2011-01-12,2011-09-28,2.25
22496,SET OF 2 ROUND TINS DUTCH CHEESE,2.95,195,2011-01-11,2011-09-06,3.5
84870C,GREEN GEISHA GIRL ,3.75,158,2011-01-10,2011-09-02,1.75
84870B,BLUE GEISHA GIRL ,3.75,199,2011-01-10,2011-09-27,4.75
22765,NEWSPAPER STAND,14.95,124,2010-11-30,2010-12-09,4.0
21351,CINAMMON & ORANGE WREATH,6.75,61,2011-01-29,2011-09-27,1.5
22581,WOOD STOCKING CHRISTMAS SCANDISPOT,0.85,175,2011-01-16,2011-09-09,3.0
22579,WOODEN TREE CHRISTMAS SCANDINAVIAN,0.85,222,2011-01-16,2011-09-09,4.5
22572,ROCKING HORSE GREEN CHRISTMAS ,0.85,68,2011-01-09,2011-09-09,2.0
22640,SET OF 4 NAPKIN CHARMS 3 KEYS ,2.55,241,2011-01-09,2011-09-20,5.0
22641,SET OF 4 NAPKIN CHARMS INSTRUMENT,2.55,185,2011-01-09,2011-09-20,2.25
22638,SET OF 4 NAPKIN CHARMS CROWNS ,2.55,104,2011-01-09,2011-09-23,1.0
22576,SWALLOW WOODEN CHRISTMAS DECORATION,0.85,129,2011-01-11,2011-09-07,4.25
21817,GLITTER CHRISTMAS TREE,0.85,95,2011-10-09,2011-09-30,2.25
21813,GARLAND WITH STARS AND BELLS,4.95,63,2011-10-09,2011-09-07,1.0
21808,"CHRISTMAS GARLAND STARS,TREES",3.75,89,2011-10-09,2011-09-28,2.5
21014,SWISS CHALET TREE DECORATION ,0.85,138,2011-01-11,2011-09-07,1.0
21018,BIRD BOX CHRISTMAS TREE DECORATION,0.85,215,2011-11-21,2010-12-09,4.75
22946,WOODEN ADVENT CALENDAR CREAM,16.95,194,2011-01-13,2011-09-09,2.75
M,Manual,1.25,112,2011-01-09,2011-09-09,2.0
22660,DOORMAT I LOVE LONDON,7.95,250,2011-01-10,2011-09-29,4.25
21761,WOOD AND GLASS MEDICINE CABINET,29.95,215,2011-01-20,2011-09-29,2.25
21781,MA CAMPAGNE CUTLERY BOX,14.95,182,2011-01-10,2011-07-08,3.25
22696,WICKER WREATH LARGE,1.95,188,2011-01-09,2011-09-30,4.0
84360,TABLE LAMP WHITE SHADE WOOD BASE,5.95,98,2011-10-22,2011-09-29,3.25
35954,SMALL FOLKART STAR CHRISTMAS DEC,0.42,229,2011-01-10,2011-09-30,1.25
84760S,SMALL HANGING GLASS+ZINC LANTERN,1.45,249,2011-01-15,2011-05-04,5.0
85045,GREEN CHRISTMAS TREE STRING 20LIGHT,4.95,64,2011-10-03,2011-09-26,4.0
35598B,BLACK CHRISTMAS TREE 60CM,0.65,150,2011-10-16,2011-09-22,3.0
22578,WOODEN STAR CHRISTMAS SCANDINAVIAN,0.85,100,2011-01-16,2011-09-09,1.25
